src/object_detection/model/resnet50int8/build/camera.vtransform.log
[12/14/2023-17:14:21] [V] [TRT] *************** Autotuning format combination: Float(10368000,129600,360,1) -> Float(10368000,129600,360,1) ***************
[12/14/2023-17:14:21] [V] [TRT] --------------- Timing Runner: Conv_0 + Relu_1 (CaskConvolution[0x80000009])
[12/14/2023-17:14:21] [V] [TRT] Tactic Name: ampere_scudnn_128x128_relu_medium_nn_v1 Tactic: 0xf067e6205da31c2e Time: 1.85946
[12/14/2023-17:14:21] [V] [TRT] Tactic Name: ampere_scudnn_128x128_relu_small_nn_v1 Tactic: 0x503619c69ae500ff Time: 1.41297
[12/14/2023-17:14:21] [V] [TRT] Tactic Name: ampere_scudnn_128x64_relu_xregs_large_nn_v1 Tactic: 0x5deb29b7a8e275f7 Time: 1.89323
[12/14/2023-17:14:21] [V] [TRT] Tactic Name: ampere_scudnn_128x64_relu_small_nn_v1 Tactic: 0x3f243c490d502deb Time: 1.93156
[12/14/2023-17:14:22] [V] [TRT] Tactic Name: sm80_xmma_fprop_implicit_gemm_indexed_f32f32_f32f32_f32_nchwkcrs_nchw_tilesize128x64x8_stage2_warpsize1x4x1_g1_ffma_aligna4_alignc4_beta0_packed_stride Tactic: 0xede36641840ce3d2 Time: 2.1207
[12/14/2023-17:14:22] [V] [TRT] Tactic Name: sm80_xmma_fprop_implicit_gemm_indexed_f32f32_f32f32_f32_nchwkcrs_nchw_tilesize128x32x8_stage3_warpsize2x2x1_g1_ffma_aligna4_alignc4 Tactic: 0xa9366041633a5135 Time: 2.50284
[12/14/2023-17:14:22] [V] [TRT] Tactic Name: sm80_xmma_fprop_implicit_gemm_indexed_f32f32_f32f32_f32_nchwkcrs_nchw_tilesize128x64x8_stage2_warpsize4x1x1_g1_ffma_aligna4_alignc4_beta0_packed_stride Tactic: 0x1673e3594ce11cea Time: 2.25426
[12/14/2023-17:14:22] [V] [TRT] Tactic Name: sm80_xmma_fprop_wngd_f32f32_f32_f32_nchwkcrs_nchw_tilesize8x16x32x8_warpsize8x1x1_wngd2x2 Tactic: 0xe47e164f4a743900 Time: 0.91253
[12/14/2023-17:14:22] [V] [TRT] Fast skip Tactic:0xcb8a43f748d8a338 which exceed time limit during pre-run
[12/14/2023-17:14:22] [V] [TRT] Tactic Name: sm80_xmma_fprop_implicit_gemm_indexed_f32f32_f32f32_f32_nchwkcrs_nchw_tilesize32x32x8_stage3_warpsize1x2x1_g1_ffma_aligna4_alignc4 Tactic: 0xcb8a43f748d8a338 Time: 2.70541
[12/14/2023-17:14:22] [V] [TRT] Fast skip Tactic:0x5aa723e0481da855 which exceed time limit during pre-run
[12/14/2023-17:14:22] [V] [TRT] Tactic Name: sm80_xmma_fprop_implicit_gemm_f32f32_f32f32_f32_nchwkcrs_nchw_tilesize64x128x8_stage3_warpsize1x4x1_g1_ffma_aligna4_alignc4 Tactic: 0x5aa723e0481da855 Time: 2.30502
[12/14/2023-17:14:22] [V] [TRT] Fast skip Tactic:0x7fc93550f5b9c127 which exceed time limit during pre-run
[12/14/2023-17:14:22] [V] [TRT] Tactic Name: sm80_xmma_fprop_implicit_gemm_f32f32_f32f32_f32_nchwkcrs_nchw_tilesize128x64x8_stage2_warpsize1x4x1_g1_ffma_t1r3s3_aligna4_alignc4_beta0_packed_stride Tactic: 0x7fc93550f5b9c127 Time: 2.10944
[12/14/2023-17:14:22] [V] [TRT] Fast skip Tactic:0x40a12e3938221818 which exceed time limit during pre-run
[12/14/2023-17:14:22] [V] [TRT] Tactic Name: sm80_xmma_fprop_implicit_gemm_indexed_f32f32_f32f32_f32_nchwkcrs_nchw_tilesize128x16x8_stage3_warpsize4x1x1_g1_ffma_aligna4_alignc4 Tactic: 0x40a12e3938221818 Time: 3.00278
[12/14/2023-17:14:22] [V] [TRT] Fast skip Tactic:0x01cf8ce2da913006 which exceed time limit during pre-run
[12/14/2023-17:14:22] [V] [TRT] Tactic Name: sm80_xmma_fprop_implicit_gemm_f32f32_f32f32_f32_nchwkcrs_nchw_tilesize64x128x8_stage3_warpsize1x4x1_g1_ffma_t1r3s3_aligna4_alignc4 Tactic: 0x01cf8ce2da913006 Time: 2.11866
[12/14/2023-17:14:22] [V] [TRT] Fast skip Tactic:0xb0bf940d5e0f9f45 which exceed time limit during pre-run
[12/14/2023-17:14:22] [V] [TRT] Tactic Name: sm80_xmma_fprop_implicit_gemm_f32f32_f32f32_f32_nchwkcrs_nchw_tilesize32x32x8_stage3_warpsize1x2x1_g1_ffma_aligna4_alignc4 Tactic: 0xb0bf940d5e0f9f45 Time: 2.28467
[12/14/2023-17:14:22] [V] [TRT] Fast skip Tactic:0xd828f024626fa982 which exceed time limit during pre-run
[12/14/2023-17:14:22] [V] [TRT] Tactic Name: sm80_xmma_fprop_implicit_gemm_indexed_f32f32_f32f32_f32_nchwkcrs_nchw_tilesize64x64x8_stage3_warpsize1x4x1_g1_ffma_aligna4_alignc4 Tactic: 0xd828f024626fa982 Time: 2.52314
[12/14/2023-17:14:22] [V] [TRT] Fast skip Tactic:0x31aa67f57c5aea77 which exceed time limit during pre-run
[12/14/2023-17:14:22] [V] [TRT] Tactic Name: sm80_xmma_fprop_implicit_gemm_indexed_f32f32_f32f32_f32_nchwkcrs_nchw_tilesize128x64x8_stage2_warpsize2x2x1_g1_ffma_aligna4_alignc4_beta0_packed_stride Tactic: 0x31aa67f57c5aea77 Time: 2.33165
[12/14/2023-17:14:22] [V] [TRT] Fast skip Tactic:0x9d9fdb5fd9945f64 which exceed time limit during pre-run
[12/14/2023-17:14:22] [V] [TRT] Tactic Name: sm80_xmma_fprop_implicit_gemm_f32f32_f32f32_f32_nchwkcrs_nchw_tilesize128x16x8_stage3_warpsize4x1x1_g1_ffma_aligna4_alignc4 Tactic: 0x9d9fdb5fd9945f64 Time: 2.41562
[12/14/2023-17:14:22] [V] [TRT] Fast skip Tactic:0x4efce38acc876f5c which exceed time limit during pre-run
[12/14/2023-17:14:22] [V] [TRT] Tactic Name: sm80_xmma_fprop_implicit_gemm_f32f32_f32f32_f32_nchwkcrs_nchw_tilesize256x128x8_stage3_warpsize4x2x1_g1_ffma_t1r3s3_aligna4_alignc4 Tactic: 0x4efce38acc876f5c Time: 2.25792
[12/14/2023-17:14:22] [V] [TRT] Fast skip Tactic:0x4727434768e46395 which exceed time limit during pre-run
[12/14/2023-17:14:22] [V] [TRT] Tactic Name: sm80_xmma_fprop_implicit_gemm_f32f32_f32f32_f32_nchwkcrs_nchw_tilesize64x64x8_stage3_warpsize1x4x1_g1_ffma_t1r3s3_aligna4_alignc4 Tactic: 0x4727434768e46395 Time: 2.24666
[12/14/2023-17:14:22] [V] [TRT] Tactic Name: sm80_xmma_fprop_wngd_f32f32_f32_f32_nchwkcrs_nchw_tilesize8x16x16x8_warpsize8x1x1_wngd2x2 Tactic: 0xe38e9dfd56c33779 Time: 0.944462
[12/14/2023-17:14:22] [V] [TRT] Tactic Name: ampere_scudnn_winograd_128x128_ldg1_ldg4_relu_tile148t_nt_v1 Tactic: 0x94119b4c514b211a Time: 0.876942
[12/14/2023-17:14:22] [V] [TRT] Tactic Name: ampere_scudnn_128x32_relu_small_nn_v1 Tactic: 0xa8609adc4e0ceb90 Time: 1.25469
[12/14/2023-17:14:22] [V] [TRT] Fast skip Tactic:0xf64396b97c889179 which exceed time limit during pre-run
[12/14/2023-17:14:22] [V] [TRT] Tactic Name: ampere_scudnn_128x64_relu_medium_nn_v1 Tactic: 0xf64396b97c889179 Time: 2.60506
[12/14/2023-17:14:22] [V] [TRT] Tactic Name: sm80_xmma_fprop_implicit_gemm_f32f32_f32f32_f32_nchwkcrs_nchw_tilesize128x64x8_stage2_warpsize4x1x1_g1_ffma_t1r3s3_aligna4_alignc4_beta0_packed_stride Tactic: 0xe640ceafd7d34ca9 Time: 1.38825
[12/14/2023-17:14:22] [V] [TRT] Tactic Name: sm80_xmma_fprop_implicit_gemm_f32f32_f32f32_f32_nchwkcrs_nchw_tilesize128x64x8_stage3_warpsize2x2x1_g1_ffma_aligna4_alignc4 Tactic: 0x12dbf7d94ee3696d Time: 1.5085
[12/14/2023-17:14:22] [V] [TRT] Fast skip Tactic:0x8ad32616b1424be4 which exceed time limit during pre-run
[12/14/2023-17:14:22] [V] [TRT] Tactic Name: sm80_xmma_fprop_implicit_gemm_f32f32_f32f32_f32_nchwkcrs_nchw_tilesize32x32x8_stage3_warpsize1x2x1_g1_ffma_t1r3s3_aligna4_alignc4 Tactic: 0x8ad32616b1424be4 Time: 1.82374
[12/14/2023-17:14:22] [V] [TRT] Tactic Name: sm80_xmma_fprop_implicit_gemm_f32f32_f32f32_f32_nchwkcrs_nchw_tilesize128x64x8_stage2_warpsize2x2x1_g1_ffma_t1r3s3_aligna4_alignc4_beta0_packed_stride Tactic: 0x3712e3e595645874 Time: 1.27503
[12/14/2023-17:14:22] [V] [TRT] Tactic Name: sm80_xmma_fprop_wngd_f32f32_f32_f32_nchwkcrs_nchw_tilesize8x16x64x8_warpsize8x1x1_wngd2x2 Tactic: 0x0190806602534cfd Time: 0.790382
[12/14/2023-17:14:22] [V] [TRT] Fast skip Tactic:0xa31d27de74b895ff which exceed time limit during pre-run
[12/14/2023-17:14:22] [V] [TRT] Tactic Name: sm80_xmma_fprop_implicit_gemm_f32f32_f32f32_f32_nchwkcrs_nchw_tilesize64x64x8_stage3_warpsize1x4x1_g1_ffma_aligna4_alignc4 Tactic: 0xa31d27de74b895ff Time: 1.96419
[12/14/2023-17:14:22] [V] [TRT] Fast skip Tactic:0xbb8c3889c7eacd30 which exceed time limit during pre-run
[12/14/2023-17:14:22] [V] [TRT] Tactic Name: sm80_xmma_fprop_implicit_gemm_f32f32_f32f32_f32_nchwkcrs_nchw_tilesize256x128x8_stage3_warpsize4x2x1_g1_ffma_aligna4_alignc4 Tactic: 0xbb8c3889c7eacd30 Time: 1.75104
[12/14/2023-17:14:22] [V] [TRT] Conv_0 + Relu_1 (CaskConvolution[0x80000009]) profiling completed in 0.324073 seconds. Fastest Tactic: 0x0190806602534cfd Time: 0.790382
[12/14/2023-17:14:22] [V] [TRT] --------------- Timing Runner: Conv_0 + Relu_1 (CudnnConvolution[0x80000000])
[12/14/2023-17:14:22] [V] [TRT] CudnnConvolution has no valid tactics for this config, skipping
[12/14/2023-17:14:22] [V] [TRT] --------------- Timing Runner: Conv_0 + Relu_1 (CaskFlattenConvolution[0x80000036])
[12/14/2023-17:14:22] [V] [TRT] CaskFlattenConvolution has no valid tactics for this config, skipping
[12/14/2023-17:14:22] [V] [TRT] >>>>>>>>>>>>>>> Chose Runner Type: CaskConvolution Tactic: 0x0190806602534cfd
[12/14/2023-17:14:22] [V] [TRT] *************** Autotuning format combination: Float(10368000,1,28800,80) -> Float(10368000,1,28800,80) ***************
[12/14/2023-17:14:22] [V] [TRT] --------------- Timing Runner: Conv_0 + Relu_1 (CaskConvolution[0x80000009])
[12/14/2023-17:14:22] [V] [TRT] Tactic Name: sm80_xmma_fprop_implicit_gemm_f32f32_f32f32_f32_nhwckrsc_nhwc_tilesize64x256x8_stage3_warpsize1x4x1_g1_ffma_t1r3s3_aligna4_alignc4 Tactic: 0x3f0c846d6379bc98 Time: 2.55927
[12/14/2023-17:14:22] [V] [TRT] Tactic Name: sm80_xmma_fprop_implicit_gemm_indexed_f32f32_f32f32_f32_nhwckrsc_nhwc_tilesize64x64x8_stage3_warpsize1x4x1_g1_ffma_aligna4_alignc4 Tactic: 0x19b688348f983aa0 Time: 1.57842
[12/14/2023-17:14:22] [V] [TRT] Tactic Name: sm80_xmma_fprop_implicit_gemm_f32f32_f32f32_f32_nhwckrsc_nhwc_tilesize128x64x8_stage3_warpsize2x2x1_g1_ffma_t1r3s3_aligna4_alignc4 Tactic: 0xf48db81f02eca9ee Time: 1.39717
[12/14/2023-17:14:22] [V] [TRT] Tactic Name: sm80_xmma_fprop_implicit_gemm_f32f32_f32f32_f32_nhwckrsc_nhwc_tilesize128x16x8_stage3_warpsize4x1x1_g1_ffma_aligna4_alignc4 Tactic: 0x92ed3100c35fc43e Time: 1.5006
[12/14/2023-17:14:22] [V] [TRT] Tactic Name: sm80_xmma_fprop_implicit_gemm_f32f32_f32f32_f32_nhwckrsc_nhwc_tilesize32x32x8_stage3_warpsize1x2x1_g1_ffma_t1r3s3_aligna4_alignc4 Tactic: 0x5953bec563d26434 Time: 1.76805
[12/14/2023-17:14:22] [V] [TRT] Tactic Name: sm80_xmma_fprop_implicit_gemm_f32f32_f32f32_f32_nhwckrsc_nhwc_tilesize256x64x8_stage3_warpsize2x2x1_g1_ffma_aligna4_alignc4 Tactic: 0x8014228ec08b4d49 Time: 1.37729
[12/14/2023-17:14:22] [V] [TRT] Tactic Name: sm80_xmma_fprop_implicit_gemm_f32f32_f32f32_f32_nhwckrsc_nhwc_tilesize128x64x8_stage3_warpsize2x2x1_g1_ffma_aligna4_alignc4 Tactic: 0x1da91d865428f237 Time: 1.4993
[12/14/2023-17:14:22] [V] [TRT] Tactic Name: sm80_xmma_fprop_implicit_gemm_indexed_f32f32_f32f32_f32_nhwckrsc_nhwc_tilesize128x16x8_stage3_warpsize4x1x1_g1_ffma_aligna4_alignc4 Tactic: 0x4fd3c46622e98342 Time: 1.9124
[12/14/2023-17:14:22] [V] [TRT] Tactic Name: sm80_xmma_fprop_implicit_gemm_f32f32_f32f32_f32_nhwckrsc_nhwc_tilesize128x16x8_stage3_warpsize4x1x1_g1_ffma_t1r3s3_aligna4_alignc4 Tactic: 0x32059de4888dfdda Time: 1.60007
[12/14/2023-17:14:22] [V] [TRT] Tactic Name: sm80_xmma_fprop_implicit_gemm_f32f32_f32f32_f32_nhwckrsc_nhwc_tilesize32x32x8_stage3_warpsize1x2x1_g1_ffma_aligna4_alignc4 Tactic: 0x7121ec1db3f80c67 Time: 1.80999
[12/14/2023-17:14:22] [V] [TRT] Tactic Name: sm80_xmma_fprop_implicit_gemm_f32f32_f32f32_f32_nhwckrsc_nhwc_tilesize64x128x8_stage3_warpsize1x4x1_g1_ffma_t1r3s3_aligna4_alignc4 Tactic: 0xd15dd11d64344e83 Time: 1.38167
[12/14/2023-17:14:22] [V] [TRT] Tactic Name: sm80_xmma_fprop_implicit_gemm_indexed_f32f32_f32f32_f32_nhwckrsc_nhwc_tilesize32x32x8_stage3_warpsize1x2x1_g1_ffma_aligna4_alignc4 Tactic: 0x0a143be7a52f301a Time: 2.07872
[12/14/2023-17:14:22] [V] [TRT] Tactic Name: sm80_xmma_fprop_implicit_gemm_f32f32_f32f32_f32_nhwckrsc_nhwc_tilesize64x64x8_stage3_warpsize1x4x1_g1_ffma_aligna4_alignc4 Tactic: 0x62835fce994f06dd Time: 1.52024
[12/14/2023-17:14:22] [V] [TRT] Tactic Name: sm80_xmma_fprop_implicit_gemm_indexed_f32f32_f32f32_f32_nhwckrsc_nhwc_tilesize128x32x8_stage3_warpsize2x2x1_g1_ffma_aligna4_alignc4 Tactic: 0xa6448a1e79f1ca6f Time: 1.47895
[12/14/2023-17:14:22] [V] [TRT] Tactic Name: sm80_xmma_fprop_implicit_gemm_f32f32_f32f32_f32_nhwckrsc_nhwc_tilesize64x64x8_stage3_warpsize1x4x1_g1_ffma_t1r3s3_aligna4_alignc4 Tactic: 0x94a7db94ba744c45 Time: 1.48445
[12/14/2023-17:14:22] [V] [TRT] Conv_0 + Relu_1 (CaskConvolution[0x80000009]) profiling completed in 0.26569 seconds. Fastest Tactic: 0x8014228ec08b4d49 Time: 1.37729
[12/14/2023-17:14:22] [V] [TRT] --------------- Timing Runner: Conv_0 + Relu_1 (CaskFlattenConvolution[0x80000036])
[12/14/2023-17:14:22] [V] [TRT] CaskFlattenConvolution has no valid tactics for this config, skipping
[12/14/2023-17:14:22] [V] [TRT] >>>>>>>>>>>>>>> Chose Runner Type: CaskConvolution Tactic: 0x8014228ec08b4d49
[12/14/2023-17:14:22] [V] [TRT] *************** Autotuning format combination: Float(2592000,1:4,7200,20) -> Float(10368000,129600,360,1) ***************
[12/14/2023-17:14:22] [V] [TRT] --------------- Timing Runner: Conv_0 + Relu_1 (CaskConvolution[0x80000009])
[12/14/2023-17:14:22] [V] [TRT] Tactic Name: sm80_xmma_fprop_implicit_gemm_f32f32_tf32f32_f32_nhwckrsc_nchw_tilesize128x128x16_stage4_warpsize2x2x1_g1_tensor16x8x8_t1r3s3 Tactic: 0x9787b83bedcff6a2 Time: 0.926574
[12/14/2023-17:14:22] [V] [TRT] Tactic Name: sm80_xmma_fprop_implicit_gemm_indexed_f32f32_tf32f32_f32_nhwckrsc_nchw_tilesize128x128x16_stage4_warpsize2x2x1_g1_tensor16x8x8_alignc4 Tactic: 0xe8f7b6a5bab325f8 Time: 1.10826
[12/14/2023-17:14:22] [V] [TRT] Tactic Name: sm80_xmma_fprop_implicit_gemm_f32f32_tf32f32_f32_nhwckrsc_nchw_tilesize128x128x16_stage4_warpsize2x2x1_g1_tensor16x8x8_alignc4 Tactic: 0x9fd9fe001908ce2e Time: 0.974848
[12/14/2023-17:14:22] [V] [TRT] Tactic Name: sm80_xmma_fprop_implicit_gemm_indexed_f32f32_tf32f32_f32_nhwckrsc_nchw_tilesize128x128x16_stage4_warpsize2x2x1_g1_tensor16x8x8 Tactic: 0xe0a307ffe0ffb6a5 Time: 0.924233
[12/14/2023-17:14:22] [V] [TRT] Tactic Name: sm80_xmma_fprop_implicit_gemm_f32f32_tf32f32_f32_nhwckrsc_nchw_tilesize128x128x16_stage4_warpsize2x2x1_g1_tensor16x8x8_t1r3s3_alignc4 Tactic: 0x1323e48791e2f671 Time: 0.866011
[12/14/2023-17:14:22] [V] [TRT] Tactic Name: sm80_xmma_fprop_implicit_gemm_f32f32_tf32f32_f32_nhwckrsc_nchw_tilesize128x128x16_stage4_warpsize2x2x1_g1_tensor16x8x8 Tactic: 0x3104d85fecdd547c Time: 0.774729
[12/14/2023-17:14:22] [V] [TRT] Conv_0 + Relu_1 (CaskConvolution[0x80000009]) profiling completed in 0.064532 seconds. Fastest Tactic: 0x3104d85fecdd547c Time: 0.774729
[12/14/2023-17:14:22] [V] [TRT] --------------- Timing Runner: Conv_0 + Relu_1 (CaskFlattenConvolution[0x80000036])
[12/14/2023-17:14:22] [V] [TRT] CaskFlattenConvolution has no valid tactics for this config, skipping
[12/14/2023-17:14:22] [V] [TRT] >>>>>>>>>>>>>>> Chose Runner Type: CaskConvolution Tactic: 0x3104d85fecdd547c
[12/14/2023-17:14:22] [V] [TRT] *************** Autotuning format combination: Float(2592000,1:4,7200,20) -> Float(2592000,1:4,7200,20) ***************
[12/14/2023-17:14:22] [V] [TRT] --------------- Timing Runner: Conv_0 + Relu_1 (CaskConvolution[0x80000009])
[12/14/2023-17:14:22] [V] [TRT] Tactic Name: ampere_scudnn_128x32_sliced1x4_ldg4_relu_exp_small_nhwc_tn_v1 Tactic: 0x3e2b881168d9689d Time: 1.12976
[12/14/2023-17:14:22] [V] [TRT] Tactic Name: ampere_scudnn_128x128_ldg4_relu_exp_medium_nhwc_tn_v1 Tactic: 0x7bc32c782b800c48 Time: 1.14644
[12/14/2023-17:14:22] [V] [TRT] Tactic Name: ampere_scudnn_128x64_sliced1x2_ldg4_relu_exp_large_nhwc_tn_v1 Tactic: 0xbdfdef6b84f7ccc9 Time: 1.96169
[12/14/2023-17:14:22] [V] [TRT] Tactic Name: ampere_scudnn_128x128_ldg4_relu_exp_small_nhwc_tn_v1 Tactic: 0xf90060ce8193b811 Time: 1.62538
[12/14/2023-17:14:22] [V] [TRT] Tactic Name: sm80_xmma_fprop_implicit_gemm_f32f32_tf32f32_f32_nhwckrsc_nhwc_tilesize128x128x16_stage4_warpsize2x2x1_g1_tensor16x8x8 Tactic: 0xb443c221fcb1565b Time: 1.01527
[12/14/2023-17:14:22] [V] [TRT] Tactic Name: sm80_xmma_fprop_implicit_gemm_f32f32_tf32f32_f32_nhwckrsc_nhwc_tilesize128x128x16_stage4_warpsize2x2x1_g1_tensor16x8x8_t1r3s3 Tactic: 0x999e005e3b016ea6 Time: 1.00674
[12/14/2023-17:14:22] [V] [TRT] Tactic Name: sm80_xmma_fprop_implicit_gemm_indexed_f32f32_tf32f32_f32_nhwckrsc_nhwc_tilesize128x128x16_stage4_warpsize2x2x1_g1_tensor16x8x8 Tactic: 0x65e41d81f093b482 Time: 1.01174
[12/14/2023-17:14:22] [V] [TRT] Conv_0 + Relu_1 (CaskConvolution[0x80000009]) profiling completed in 0.0974159 seconds. Fastest Tactic: 0x999e005e3b016ea6 Time: 1.00674
[12/14/2023-17:14:22] [V] [TRT] --------------- Timing Runner: Conv_0 + Relu_1 (CaskFlattenConvolution[0x80000036])
[12/14/2023-17:14:22] [V] [TRT] CaskFlattenConvolution has no valid tactics for this config, skipping
[12/14/2023-17:14:22] [V] [TRT] >>>>>>>>>>>>>>> Chose Runner Type: CaskConvolution Tactic: 0x999e005e3b016ea6
[12/14/2023-17:14:22] [V] [TRT] *************** Autotuning format combination: Half(10368000,129600,360,1) -> Half(10368000,129600,360,1) ***************
[12/14/2023-17:14:22] [V] [TRT] --------------- Timing Runner: Conv_0 + Relu_1 (CaskConvolution[0x80000009])
[12/14/2023-17:14:22] [V] [TRT] CaskConvolution has no valid tactics for this config, skipping
[12/14/2023-17:14:22] [V] [TRT] --------------- Timing Runner: Conv_0 + Relu_1 (CudnnConvolution[0x80000000])
[12/14/2023-17:14:22] [V] [TRT] CudnnConvolution has no valid tactics for this config, skipping
[12/14/2023-17:14:22] [V] [TRT] --------------- Timing Runner: Conv_0 + Relu_1 (CaskFlattenConvolution[0x80000036])
[12/14/2023-17:14:22] [V] [TRT] CaskFlattenConvolution has no valid tactics for this config, skipping
[12/14/2023-17:14:22] [V] [TRT] *************** Autotuning format combination: Half(5184000,1:2,14400,40) -> Half(5184000,1:2,14400,40) ***************
[12/14/2023-17:14:22] [V] [TRT] --------------- Timing Runner: Conv_0 + Relu_1 (CaskConvolution[0x80000009])
[12/14/2023-17:14:22] [V] [TRT] CaskConvolution has no valid tactics for this config, skipping
[12/14/2023-17:14:22] [V] [TRT] --------------- Timing Runner: Conv_0 + Relu_1 (CaskFlattenConvolution[0x80000036])
[12/14/2023-17:14:22] [V] [TRT] CaskFlattenConvolution has no valid tactics for this config, skipping
[12/14/2023-17:14:22] [V] [TRT] *************** Autotuning format combination: Half(2592000,1:4,7200,20) -> Half(2592000,1:4,7200,20) ***************
[12/14/2023-17:14:22] [V] [TRT] --------------- Timing Runner: Conv_0 + Relu_1 (CaskConvolution[0x80000009])
[12/14/2023-17:14:22] [V] [TRT] CaskConvolution has no valid tactics for this config, skipping
[12/14/2023-17:14:22] [V] [TRT] --------------- Timing Runner: Conv_0 + Relu_1 (CaskFlattenConvolution[0x80000036])
[12/14/2023-17:14:22] [V] [TRT] CaskFlattenConvolution has no valid tactics for this config, skipping
[12/14/2023-17:14:22] [V] [TRT] *************** Autotuning format combination: Half(1296000,1:8,3600,10) -> Float(10368000,129600,360,1) ***************
[12/14/2023-17:14:22] [V] [TRT] --------------- Timing Runner: Conv_0 + Relu_1 (CaskConvolution[0x80000009])
[12/14/2023-17:14:22] [V] [TRT] CaskConvolution has no valid tactics for this config, skipping
[12/14/2023-17:14:22] [V] [TRT] --------------- Timing Runner: Conv_0 + Relu_1 (CaskFlattenConvolution[0x80000036])
[12/14/2023-17:14:22] [V] [TRT] CaskFlattenConvolution has no valid tactics for this config, skipping
[12/14/2023-17:14:22] [V] [TRT] *************** Autotuning format combination: Half(1296000,1:8,3600,10) -> Half(1296000,1:8,3600,10) ***************
[12/14/2023-17:14:22] [V] [TRT] --------------- Timing Runner: Conv_0 + Relu_1 (CaskConvolution[0x80000009])
[12/14/2023-17:14:22] [V] [TRT] Tactic Name: sm80_xmma_fprop_implicit_gemm_indexed_f16f16_f16f16_f16_nhwckrsc_nhwc_tilesize256x32x32_stage4_warpsize4x1x1_g1_tensor16x8x16 Tactic: 0xdce100b9fe609424 Time: 0.433449
[12/14/2023-17:14:22] [V] [TRT] Tactic Name: sm80_xmma_fprop_implicit_gemm_f16f16_f16f16_f16_nhwckrsc_nhwc_tilesize128x256x32_stage3_warpsize2x4x1_g1_tensor16x8x16_t1r3s3 Tactic: 0xa9177bbe4e767df8 Time: 0.63093
[12/14/2023-17:14:22] [V] [TRT] Tactic Name: sm80_xmma_fprop_implicit_gemm_f16f16_f16f16_f16_nhwckrsc_nhwc_tilesize128x64x64_stage3_warpsize2x2x1_g1_tensor16x8x16_t1r3s3 Tactic: 0x05b6220f243edacd Time: 0.480928
[12/14/2023-17:14:22] [V] [TRT] Tactic Name: sm80_xmma_fprop_implicit_gemm_f16f16_f16f16_f16_nhwckrsc_nhwc_tilesize256x128x32_stage3_warpsize4x2x1_g1_tensor16x8x16 Tactic: 0x60da8c7151d91e47 Time: 0.256731
[12/14/2023-17:14:22] [V] [TRT] Tactic Name: sm80_xmma_fprop_implicit_gemm_f16f16_f16f16_f16_nhwckrsc_nhwc_tilesize128x128x32_stage4_warpsize2x2x1_g1_tensor16x8x16 Tactic: 0xdfa020ef435ef810 Time: 0.237568
[12/14/2023-17:14:22] [V] [TRT] Tactic Name: sm80_xmma_fprop_wngd_f16f16_f16_f16_nhwckrsc_nhwc_tilesize8x16x32x32_warpsize8x1x1_wngd2x2 Tactic: 0xded5318b4a444b84 Time: 0.4608
[12/14/2023-17:14:22] [V] [TRT] Tactic Name: sm80_xmma_fprop_implicit_gemm_f16f16_f16f16_f16_nhwckrsc_nhwc_tilesize128x64x64_stage3_warpsize2x2x1_g1_tensor16x8x16 Tactic: 0x5568fd8a32f4a40f Time: 0.485669
[12/14/2023-17:14:22] [V] [TRT] Tactic Name: sm80_xmma_fprop_implicit_gemm_f16f16_f16f16_f16_nhwckrsc_nhwc_tilesize128x128x64_stage3_warpsize2x2x1_g1_tensor16x8x16_t1r3s3 Tactic: 0xc0a02dc6095497cc Time: 0.452754
[12/14/2023-17:14:22] [V] [TRT] Tactic Name: sm80_xmma_fprop_implicit_gemm_f16f16_f16f16_f16_nhwckrsc_nhwc_tilesize128x64x32_stage5_warpsize2x2x1_g1_tensor16x8x16_t1r3s3 Tactic: 0xb4bec086187edcfc Time: 0.259657
[12/14/2023-17:14:22] [V] [TRT] Tactic Name: sm80_xmma_fprop_implicit_gemm_f16f16_f16f16_f16_nhwckrsc_nhwc_tilesize128x128x64_stage3_warpsize2x2x1_g1_tensor16x8x16 Tactic: 0x57c9a5ff682354a6 Time: 0.461239
[12/14/2023-17:14:22] [V] [TRT] Tactic Name: sm80_xmma_fprop_implicit_gemm_f16f16_f16f16_f16_nhwckrsc_nhwc_tilesize64x128x32_stage5_warpsize2x2x1_g1_tensor16x8x16 Tactic: 0xdb0b80f591d1bb6d Time: 0.253664
[12/14/2023-17:14:22] [V] [TRT] Tactic Name: sm80_xmma_fprop_implicit_gemm_f16f16_f16f16_f16_nhwckrsc_nhwc_tilesize64x64x64_stage4_warpsize2x2x1_g1_tensor16x8x16_t1r3s3 Tactic: 0x31d93dc22d2af081 Time: 0.549595
[12/14/2023-17:14:22] [V] [TRT] Tactic Name: sm80_xmma_fprop_implicit_gemm_f16f16_f16f16_f16_nhwckrsc_nhwc_tilesize64x32x64_stage5_warpsize2x2x1_g1_tensor16x8x16 Tactic: 0x5820b3dda403c4d0 Time: 0.627858
[12/14/2023-17:14:22] [V] [TRT] Tactic Name: sm80_xmma_fprop_implicit_gemm_indexed_f16f16_f16f16_f16_nhwckrsc_nhwc_tilesize256x128x32_stage3_warpsize4x2x1_g1_tensor16x8x16 Tactic: 0xb17d53d15dfbfc9e Time: 0.408722
[12/14/2023-17:14:22] [V] [TRT] Tactic Name: sm80_xmma_fprop_implicit_gemm_indexed_f16f16_f16f16_f16_nhwckrsc_nhwc_tilesize128x64x64_stage3_warpsize2x2x1_g1_tensor16x8x16 Tactic: 0x21b295c0c8f6c95a Time: 0.491959
[12/14/2023-17:14:22] [V] [TRT] Tactic Name: sm80_xmma_fprop_implicit_gemm_indexed_f16f16_f16f16_f16_nhwckrsc_nhwc_tilesize64x32x64_stage5_warpsize2x2x1_g1_tensor16x8x16 Tactic: 0xe1ff5ad20f5c6bf6 Time: 0.63371
[12/14/2023-17:14:22] [V] [TRT] Tactic Name: sm80_xmma_fprop_implicit_gemm_f16f16_f16f16_f16_nhwckrsc_nhwc_tilesize128x64x32_stage5_warpsize2x2x1_g1_tensor16x8x16 Tactic: 0xbd08239a9317f2fd Time: 0.407406
[12/14/2023-17:14:22] [V] [TRT] Tactic Name: sm80_xmma_fprop_implicit_gemm_f16f16_f16f16_f16_nhwckrsc_nhwc_tilesize256x64x32_stage3_warpsize4x1x1_g1_tensor16x8x16_t1r3s3_aACCESS Tactic: 0x0866ddee325d07a6 Time: 0.252535
[12/14/2023-17:14:22] [V] [TRT] Tactic Name: sm80_xmma_fprop_implicit_gemm_indexed_f16f16_f16f16_f16_nhwckrsc_nhwc_tilesize256x64x32_stage3_warpsize4x1x1_g1_tensor16x8x16 Tactic: 0xa570c55d303796ff Time: 0.253806
[12/14/2023-17:14:22] [V] [TRT] Tactic Name: sm80_xmma_fprop_implicit_gemm_indexed_f16f16_f16f16_f16_nhwckrsc_nhwc_tilesize64x64x64_stage4_warpsize2x2x1_g1_tensor16x8x16 Tactic: 0x4a81ea1e51436a30 Time: 0.549742
[12/14/2023-17:14:22] [V] [TRT] Tactic Name: sm80_xmma_fprop_implicit_gemm_indexed_f16f16_f16f16_f16_nhwckrsc_nhwc_tilesize128x128x32_stage4_warpsize2x2x1_g1_tensor16x8x16 Tactic: 0x0e07ff4f4f7c1ac9 Time: 0.253083
[12/14/2023-17:14:22] [V] [TRT] Tactic Name: sm80_xmma_fprop_implicit_gemm_indexed_f16f16_f16f16_f16_nhwckrsc_nhwc_tilesize128x64x32_stage5_warpsize2x2x1_g1_tensor16x8x16 Tactic: 0xc9d24bd069159fa8 Time: 0.466359
[12/14/2023-17:14:22] [V] [TRT] Tactic Name: sm80_xmma_fprop_implicit_gemm_f16f16_f16f16_f16_nhwckrsc_nhwc_tilesize128x128x32_stage4_warpsize2x2x1_g1_tensor16x8x16_t1r3s3 Tactic: 0x60c3421152ef8e10 Time: 0.236398
[12/14/2023-17:14:22] [V] [TRT] Tactic Name: sm80_xmma_fprop_implicit_gemm_f16f16_f16f16_f16_nhwckrsc_nhwc_tilesize128x256x32_stage3_warpsize2x4x1_g1_tensor16x8x16 Tactic: 0xa1a20ea714d420f4 Time: 0.586167
[12/14/2023-17:14:22] [V] [TRT] Tactic Name: sm80_xmma_fprop_implicit_gemm_indexed_f16f16_f16f16_f16_nhwckrsc_nhwc_tilesize128x32x32_stage4_warpsize4x1x1_g1_tensor16x8x16 Tactic: 0xf79479a62ea9f901 Time: 0.44032
[12/14/2023-17:14:22] [V] [TRT] Tactic Name: sm80_xmma_fprop_implicit_gemm_f16f16_f16f16_f16_nhwckrsc_nhwc_tilesize256x32x32_stage4_warpsize4x1x1_g1_tensor16x8x16 Tactic: 0xa83b68f30462f971 Time: 0.429349
[12/14/2023-17:14:22] [V] [TRT] Tactic Name: sm80_xmma_fprop_implicit_gemm_f16f16_f16f16_f16_nhwckrsc_nhwc_tilesize128x32x32_stage4_warpsize4x1x1_g1_tensor16x8x16 Tactic: 0x834e11ecd4ab9454 Time: 0.455387
[12/14/2023-17:14:22] [V] [TRT] Tactic Name: sm80_xmma_fprop_wngd_f16f16_f16_f16_nhwckrsc_nhwc_tilesize16x16x64x16_warpsize8x1x1_wngd2x2 Tactic: 0xe29800439b9d3cf7 Time: 0.22885
[12/14/2023-17:14:22] [V] [TRT] Tactic Name: sm80_xmma_fprop_implicit_gemm_indexed_f16f16_f16f16_f16_nhwckrsc_nhwc_tilesize128x256x32_stage3_warpsize2x4x1_g1_tensor16x8x16 Tactic: 0x7005d10718f6c22d Time: 0.583241
[12/14/2023-17:14:22] [V] [TRT] Tactic Name: sm80_xmma_fprop_implicit_gemm_f16f16_f16f16_f16_nhwckrsc_nhwc_tilesize256x64x32_stage3_warpsize4x1x1_g1_tensor16x8x16 Tactic: 0xd1aaad17ca35fbaa Time: 0.246053
[12/14/2023-17:14:22] [V] [TRT] Tactic Name: sm80_xmma_fprop_implicit_gemm_f16f16_f16f16_f16_nhwckrsc_nhwc_tilesize128x128x32_stage4_warpsize2x2x1_g1_tensor16x8x16_t1r3s3_aACCESS Tactic: 0x245530c34bd6090f Time: 0.235529
[12/14/2023-17:14:22] [V] [TRT] Tactic Name: sm80_xmma_fprop_implicit_gemm_f16f16_f16f16_f16_nhwckrsc_nhwc_tilesize64x64x64_stage4_warpsize2x1x2_g1_tensor16x8x16_aACCESS Tactic: 0x841c601dec2a75bc Time: 0.506569
[12/14/2023-17:14:22] [V] [TRT] Tactic Name: sm80_xmma_fprop_implicit_gemm_f16f16_f16f16_f16_nhwckrsc_nhwc_tilesize64x64x64_stage4_warpsize2x2x1_g1_tensor16x8x16_t1r3s3_aACCESS Tactic: 0x30e8a8d7a953e5e9 Time: 0.574171
[12/14/2023-17:14:22] [V] [TRT] Tactic Name: sm80_xmma_fprop_implicit_gemm_f16f16_f16f16_f16_nhwckrsc_nhwc_tilesize256x128x32_stage3_warpsize4x2x1_g1_tensor16x8x16_t1r3s3 Tactic: 0x048d6d0400f33439 Time: 0.255707
[12/14/2023-17:14:22] [V] [TRT] Tactic Name: sm80_xmma_fprop_implicit_gemm_f16f16_f16f16_f16_nhwckrsc_nhwc_tilesize64x64x64_stage4_warpsize2x2x1_g1_tensor16x8x16 Tactic: 0xf35e0311fa1cc516 Time: 0.533358
[12/14/2023-17:14:22] [V] [TRT] Tactic Name: sm80_xmma_fprop_implicit_gemm_f16f16_f16f16_f16_nhwckrsc_nhwc_tilesize256x64x32_stage3_warpsize4x1x1_g1_tensor16x8x16_t1r3s3 Tactic: 0x529f4431bdae94f5 Time: 0.244736
[12/14/2023-17:14:22] [V] [TRT] Tactic Name: sm80_xmma_fprop_implicit_gemm_f16f16_f16f16_f16_nhwckrsc_nhwc_tilesize256x32x32_stage4_warpsize4x1x1_g1_tensor16x8x16_t1r3s3 Tactic: 0xa40cb43c296a36a8 Time: 0.324055
[12/14/2023-17:14:22] [V] [TRT] Tactic Name: sm80_xmma_fprop_implicit_gemm_f16f16_f16f16_f16_nhwckrsc_nhwc_tilesize128x32x32_stage4_warpsize4x1x1_g1_tensor16x8x16_t1r3s3 Tactic: 0x3e7eb35b91b9fa63 Time: 0.386926
[12/14/2023-17:14:22] [V] [TRT] Tactic Name: sm80_xmma_fprop_implicit_gemm_f16f16_f16f16_f16_nhwckrsc_nhwc_tilesize128x64x64_stage4_warpsize2x1x2_g1_tensor16x8x16 Tactic: 0x7273dde1d0cd3bd5 Time: 0.495415
[12/14/2023-17:14:22] [V] [TRT] Tactic Name: sm80_xmma_fprop_implicit_gemm_f16f16_f16f16_f16_nhwckrsc_nhwc_tilesize64x128x32_stage5_warpsize2x2x1_g1_tensor16x8x16_t1r3s3 Tactic: 0x17ebf0c9f418f10a Time: 0.249408
[12/14/2023-17:14:22] [V] [TRT] Tactic Name: sm80_xmma_fprop_implicit_gemm_f16f16_f16f16_f16_nhwckrsc_nhwc_tilesize128x64x64_stage3_warpsize2x2x1_g1_tensor16x8x16_t1r3s3_aACCESS Tactic: 0x263a38afd75e3a43 Time: 0.470016
[12/14/2023-17:14:22] [V] [TRT] Tactic Name: sm80_xmma_fprop_implicit_gemm_indexed_f16f16_f16f16_f16_nhwckrsc_nhwc_tilesize64x128x32_stage5_warpsize2x2x1_g1_tensor16x8x16 Tactic: 0xafd1e8bf6bd3d638 Time: 0.413595
[12/14/2023-17:14:23] [V] [TRT] Tactic Name: sm80_xmma_fprop_implicit_gemm_f16f16_f16f16_f16_nhwckrsc_nhwc_tilesize64x32x64_stage5_warpsize2x2x1_g1_tensor16x8x16_t1r3s3 Tactic: 0xa033e20ae9f412b2 Time: 0.626542
[12/14/2023-17:14:23] [V] [TRT] Tactic Name: sm80_xmma_fprop_implicit_gemm_indexed_f16f16_f16f16_f16_nhwckrsc_nhwc_tilesize128x128x64_stage3_warpsize2x2x1_g1_tensor16x8x16 Tactic: 0x866e7a5f6401b67f Time: 0.450089
[12/14/2023-17:14:23] [V] [TRT] Conv_0 + Relu_1 (CaskConvolution[0x80000009]) profiling completed in 0.263353 seconds. Fastest Tactic: 0xe29800439b9d3cf7 Time: 0.22885
[12/14/2023-17:14:23] [V] [TRT] --------------- Timing Runner: Conv_0 + Relu_1 (CaskFlattenConvolution[0x80000036])
[12/14/2023-17:14:23] [V] [TRT] CaskFlattenConvolution has no valid tactics for this config, skipping
[12/14/2023-17:14:23] [V] [TRT] >>>>>>>>>>>>>>> Chose Runner Type: CaskConvolution Tactic: 0xe29800439b9d3cf7
[12/14/2023-17:14:23] [V] [TRT] =============== Computing costs for 
[12/14/2023-17:14:23] [V] [TRT] *************** Autotuning format combination: Float(10368000,129600,360,1) -> Float(2592000,32400,180,1) ***************
[12/14/2023-17:14:23] [V] [TRT] --------------- Timing Runner: Conv_2 + Relu_3 (CaskConvolution[0x80000009])
[12/14/2023-17:14:23] [V] [TRT] Tactic Name: ampere_scudnn_128x128_relu_medium_nn_v1 Tactic: 0xf067e6205da31c2e Time: 0.486107
[12/14/2023-17:14:23] [V] [TRT] Tactic Name: ampere_scudnn_128x128_relu_small_nn_v1 Tactic: 0x503619c69ae500ff Time: 0.469723
[12/14/2023-17:14:23] [V] [TRT] Tactic Name: ampere_scudnn_128x64_relu_xregs_large_nn_v1 Tactic: 0x5deb29b7a8e275f7 Time: 0.468704
[12/14/2023-17:14:23] [V] [TRT] Tactic Name: ampere_scudnn_128x64_relu_small_nn_v1 Tactic: 0x3f243c490d502deb Time: 0.410478
[12/14/2023-17:14:23] [V] [TRT] Tactic Name: sm80_xmma_fprop_implicit_gemm_indexed_f32f32_f32f32_f32_nchwkcrs_nchw_tilesize128x64x8_stage2_warpsize1x4x1_g1_ffma_aligna4_alignc4_beta0_packed_stride Tactic: 0xede36641840ce3d2 Time: 0.407845
[12/14/2023-17:14:23] [V] [TRT] Tactic Name: sm80_xmma_fprop_implicit_gemm_indexed_f32f32_f32f32_f32_nchwkcrs_nchw_tilesize128x32x8_stage3_warpsize2x2x1_g1_ffma_aligna4_alignc4 Tactic: 0xa9366041633a5135 Time: 0.651008
[12/14/2023-17:14:23] [V] [TRT] Tactic Name: sm80_xmma_fprop_implicit_gemm_indexed_f32f32_f32f32_f32_nchwkcrs_nchw_tilesize128x64x8_stage2_warpsize4x1x1_g1_ffma_aligna4_alignc4_beta0_packed_stride Tactic: 0x1673e3594ce11cea Time: 0.492969
[12/14/2023-17:14:23] [V] [TRT] Tactic Name: sm80_xmma_fprop_implicit_gemm_indexed_f32f32_f32f32_f32_nchwkcrs_nchw_tilesize32x32x8_stage3_warpsize1x2x1_g1_ffma_aligna4_alignc4 Tactic: 0xcb8a43f748d8a338 Time: 0.516974
[12/14/2023-17:14:23] [V] [TRT] Tactic Name: sm80_xmma_fprop_implicit_gemm_f32f32_f32f32_f32_nchwkcrs_nchw_tilesize64x128x8_stage3_warpsize1x4x1_g1_ffma_aligna4_alignc4 Tactic: 0x5aa723e0481da855 Time: 0.387365
[12/14/2023-17:14:23] [V] [TRT] Tactic Name: sm80_xmma_fprop_implicit_gemm_f32f32_f32f32_f32_nchwkcrs_nchw_tilesize128x64x8_stage2_warpsize1x4x1_g1_ffma_t1r3s3_aligna4_alignc4_beta0_packed_stride Tactic: 0x7fc93550f5b9c127 Time: 0.423205
[12/14/2023-17:14:23] [V] [TRT] Tactic Name: sm80_xmma_fprop_implicit_gemm_indexed_f32f32_f32f32_f32_nchwkcrs_nchw_tilesize128x16x8_stage3_warpsize4x1x1_g1_ffma_aligna4_alignc4 Tactic: 0x40a12e3938221818 Time: 0.559872
[12/14/2023-17:14:23] [V] [TRT] Tactic Name: sm80_xmma_fprop_implicit_gemm_f32f32_f32f32_f32_nchwkcrs_nchw_tilesize64x128x8_stage3_warpsize1x4x1_g1_ffma_t1r3s3_aligna4_alignc4 Tactic: 0x01cf8ce2da913006 Time: 0.355767
[12/14/2023-17:14:23] [V] [TRT] Tactic Name: sm80_xmma_fprop_implicit_gemm_f32f32_f32f32_f32_nchwkcrs_nchw_tilesize32x32x8_stage3_warpsize1x2x1_g1_ffma_aligna4_alignc4 Tactic: 0xb0bf940d5e0f9f45 Time: 0.411209
[12/14/2023-17:14:23] [V] [TRT] Tactic Name: sm80_xmma_fprop_implicit_gemm_indexed_f32f32_f32f32_f32_nchwkcrs_nchw_tilesize64x64x8_stage3_warpsize1x4x1_g1_ffma_aligna4_alignc4 Tactic: 0xd828f024626fa982 Time: 0.451438
[12/14/2023-17:14:23] [V] [TRT] Tactic Name: sm80_xmma_fprop_implicit_gemm_indexed_f32f32_f32f32_f32_nchwkcrs_nchw_tilesize128x64x8_stage2_warpsize2x2x1_g1_ffma_aligna4_alignc4_beta0_packed_stride Tactic: 0x31aa67f57c5aea77 Time: 0.456997
[12/14/2023-17:14:23] [V] [TRT] Tactic Name: sm80_xmma_fprop_implicit_gemm_f32f32_f32f32_f32_nchwkcrs_nchw_tilesize128x16x8_stage3_warpsize4x1x1_g1_ffma_aligna4_alignc4 Tactic: 0x9d9fdb5fd9945f64 Time: 0.401554
[12/14/2023-17:14:23] [V] [TRT] Tactic Name: sm80_xmma_fprop_implicit_gemm_f32f32_f32f32_f32_nchwkcrs_nchw_tilesize256x128x8_stage3_warpsize4x2x1_g1_ffma_t1r3s3_aligna4_alignc4 Tactic: 0x4efce38acc876f5c Time: 0.383561
[12/14/2023-17:14:23] [V] [TRT] Tactic Name: sm80_xmma_fprop_implicit_gemm_f32f32_f32f32_f32_nchwkcrs_nchw_tilesize64x64x8_stage3_warpsize1x4x1_g1_ffma_t1r3s3_aligna4_alignc4 Tactic: 0x4727434768e46395 Time: 0.41355
[12/14/2023-17:14:23] [V] [TRT] Tactic Name: sm50_xmma_conv_fprop_fused_conv_act_fp32_NCHW_fp32_NCHW_KCRS_fp32_fp32_fp32_Accfloat_1_1_cC1_dC1_srcVec1_fltVec1_1_TP7_TQ4_C1_R3_S3_U2_V2 Tactic: 0xdb028f7ca5d4eecf Time: 0.394971
[12/14/2023-17:14:23] [V] [TRT] Tactic Name: ampere_scudnn_128x32_relu_small_nn_v1 Tactic: 0xa8609adc4e0ceb90 Time: 0.352073
[12/14/2023-17:14:23] [V] [TRT] Tactic Name: ampere_scudnn_128x64_relu_medium_nn_v1 Tactic: 0xf64396b97c889179 Time: 0.410853
[12/14/2023-17:14:23] [V] [TRT] Tactic Name: sm80_xmma_fprop_implicit_gemm_f32f32_f32f32_f32_nchwkcrs_nchw_tilesize128x64x8_stage2_warpsize4x1x1_g1_ffma_t1r3s3_aligna4_alignc4_beta0_packed_stride Tactic: 0xe640ceafd7d34ca9 Time: 0.414281
[12/14/2023-17:14:23] [V] [TRT] Tactic Name: sm80_xmma_fprop_implicit_gemm_f32f32_f32f32_f32_nchwkcrs_nchw_tilesize128x64x8_stage3_warpsize2x2x1_g1_ffma_aligna4_alignc4 Tactic: 0x12dbf7d94ee3696d Time: 0.408137
[12/14/2023-17:14:23] [V] [TRT] Tactic Name: sm80_xmma_fprop_implicit_gemm_f32f32_f32f32_f32_nchwkcrs_nchw_tilesize32x32x8_stage3_warpsize1x2x1_g1_ffma_t1r3s3_aligna4_alignc4 Tactic: 0x8ad32616b1424be4 Time: 0.424101
[12/14/2023-17:14:23] [V] [TRT] Tactic Name: sm80_xmma_fprop_implicit_gemm_f32f32_f32f32_f32_nchwkcrs_nchw_tilesize128x64x8_stage2_warpsize2x2x1_g1_ffma_t1r3s3_aligna4_alignc4_beta0_packed_stride Tactic: 0x3712e3e595645874 Time: 0.410185
[12/14/2023-17:14:23] [V] [TRT] Tactic Name: sm80_xmma_fprop_implicit_gemm_f32f32_f32f32_f32_nchwkcrs_nchw_tilesize64x64x8_stage3_warpsize1x4x1_g1_ffma_aligna4_alignc4 Tactic: 0xa31d27de74b895ff Time: 0.414574
[12/14/2023-17:14:23] [V] [TRT] Tactic Name: sm80_xmma_fprop_implicit_gemm_f32f32_f32f32_f32_nchwkcrs_nchw_tilesize256x128x8_stage3_warpsize4x2x1_g1_ffma_aligna4_alignc4 Tactic: 0xbb8c3889c7eacd30 Time: 0.37717
[12/14/2023-17:14:23] [V] [TRT] Conv_2 + Relu_3 (CaskConvolution[0x80000009]) profiling completed in 0.159535 seconds. Fastest Tactic: 0xa8609adc4e0ceb90 Time: 0.352073
[12/14/2023-17:14:23] [V] [TRT] --------------- Timing Runner: Conv_2 + Relu_3 (CudnnConvolution[0x80000000])
[12/14/2023-17:14:23] [V] [TRT] CudnnConvolution has no valid tactics for this config, skipping
[12/14/2023-17:14:23] [V] [TRT] --------------- Timing Runner: Conv_2 + Relu_3 (CaskFlattenConvolution[0x80000036])
[12/14/2023-17:14:23] [V] [TRT] CaskFlattenConvolution has no valid tactics for this config, skipping
[12/14/2023-17:14:23] [V] [TRT] >>>>>>>>>>>>>>> Chose Runner Type: CaskConvolution Tactic: 0xa8609adc4e0ceb90
[12/14/2023-17:14:23] [V] [TRT] *************** Autotuning format combination: Float(10368000,1,28800,80) -> Float(2592000,1,14400,80) ***************
[12/14/2023-17:14:23] [V] [TRT] --------------- Timing Runner: Conv_2 + Relu_3 (CaskConvolution[0x80000009])
[12/14/2023-17:14:23] [V] [TRT] Tactic Name: sm80_xmma_fprop_implicit_gemm_f32f32_f32f32_f32_nhwckrsc_nhwc_tilesize64x256x8_stage3_warpsize1x4x1_g1_ffma_t1r3s3_aligna4_alignc4 Tactic: 0x3f0c846d6379bc98 Time: 0.7264
[12/14/2023-17:14:23] [V] [TRT] Tactic Name: sm80_xmma_fprop_implicit_gemm_indexed_f32f32_f32f32_f32_nhwckrsc_nhwc_tilesize64x64x8_stage3_warpsize1x4x1_g1_ffma_aligna4_alignc4 Tactic: 0x19b688348f983aa0 Time: 0.410185
[12/14/2023-17:14:23] [V] [TRT] Tactic Name: sm80_xmma_fprop_implicit_gemm_f32f32_f32f32_f32_nhwckrsc_nhwc_tilesize128x64x8_stage3_warpsize2x2x1_g1_ffma_t1r3s3_aligna4_alignc4 Tactic: 0xf48db81f02eca9ee Time: 0.390341
[12/14/2023-17:14:23] [V] [TRT] Tactic Name: sm80_xmma_fprop_implicit_gemm_f32f32_f32f32_f32_nhwckrsc_nhwc_tilesize128x16x8_stage3_warpsize4x1x1_g1_ffma_aligna4_alignc4 Tactic: 0x92ed3100c35fc43e Time: 0.372297
[12/14/2023-17:14:23] [V] [TRT] Tactic Name: sm80_xmma_fprop_implicit_gemm_f32f32_f32f32_f32_nhwckrsc_nhwc_tilesize32x32x8_stage3_warpsize1x2x1_g1_ffma_t1r3s3_aligna4_alignc4 Tactic: 0x5953bec563d26434 Time: 0.404686
[12/14/2023-17:14:23] [V] [TRT] Tactic Name: sm80_xmma_fprop_implicit_gemm_f32f32_f32f32_f32_nhwckrsc_nhwc_tilesize256x64x8_stage3_warpsize2x2x1_g1_ffma_aligna4_alignc4 Tactic: 0x8014228ec08b4d49 Time: 0.429641
[12/14/2023-17:14:23] [V] [TRT] Tactic Name: sm80_xmma_fprop_implicit_gemm_f32f32_f32f32_f32_nhwckrsc_nhwc_tilesize128x64x8_stage3_warpsize2x2x1_g1_ffma_aligna4_alignc4 Tactic: 0x1da91d865428f237 Time: 0.37376
[12/14/2023-17:14:23] [V] [TRT] Tactic Name: sm80_xmma_fprop_implicit_gemm_indexed_f32f32_f32f32_f32_nhwckrsc_nhwc_tilesize128x16x8_stage3_warpsize4x1x1_g1_ffma_aligna4_alignc4 Tactic: 0x4fd3c46622e98342 Time: 0.455826
[12/14/2023-17:14:23] [V] [TRT] Tactic Name: sm80_xmma_fprop_implicit_gemm_f32f32_f32f32_f32_nhwckrsc_nhwc_tilesize128x16x8_stage3_warpsize4x1x1_g1_ffma_t1r3s3_aligna4_alignc4 Tactic: 0x32059de4888dfdda Time: 0.381806
[12/14/2023-17:14:23] [V] [TRT] Tactic Name: sm80_xmma_fprop_implicit_gemm_f32f32_f32f32_f32_nhwckrsc_nhwc_tilesize32x32x8_stage3_warpsize1x2x1_g1_ffma_aligna4_alignc4 Tactic: 0x7121ec1db3f80c67 Time: 0.405504
[12/14/2023-17:14:23] [V] [TRT] Tactic Name: sm80_xmma_fprop_implicit_gemm_f32f32_f32f32_f32_nhwckrsc_nhwc_tilesize64x128x8_stage3_warpsize1x4x1_g1_ffma_t1r3s3_aligna4_alignc4 Tactic: 0xd15dd11d64344e83 Time: 0.402432
[12/14/2023-17:14:23] [V] [TRT] Tactic Name: sm80_xmma_fprop_implicit_gemm_indexed_f32f32_f32f32_f32_nhwckrsc_nhwc_tilesize32x32x8_stage3_warpsize1x2x1_g1_ffma_aligna4_alignc4 Tactic: 0x0a143be7a52f301a Time: 0.459045
[12/14/2023-17:14:23] [V] [TRT] Tactic Name: sm80_xmma_fprop_implicit_gemm_f32f32_f32f32_f32_nhwckrsc_nhwc_tilesize64x64x8_stage3_warpsize1x4x1_g1_ffma_aligna4_alignc4 Tactic: 0x62835fce994f06dd Time: 0.360887
[12/14/2023-17:14:23] [V] [TRT] Tactic Name: sm80_xmma_fprop_implicit_gemm_indexed_f32f32_f32f32_f32_nhwckrsc_nhwc_tilesize128x32x8_stage3_warpsize2x2x1_g1_ffma_aligna4_alignc4 Tactic: 0xa6448a1e79f1ca6f Time: 0.378441
[12/14/2023-17:14:23] [V] [TRT] Tactic Name: sm80_xmma_fprop_implicit_gemm_f32f32_f32f32_f32_nhwckrsc_nhwc_tilesize64x64x8_stage3_warpsize1x4x1_g1_ffma_t1r3s3_aligna4_alignc4 Tactic: 0x94a7db94ba744c45 Time: 0.373614
[12/14/2023-17:14:23] [V] [TRT] Conv_2 + Relu_3 (CaskConvolution[0x80000009]) profiling completed in 0.0865968 seconds. Fastest Tactic: 0x62835fce994f06dd Time: 0.360887
[12/14/2023-17:14:23] [V] [TRT] --------------- Timing Runner: Conv_2 + Relu_3 (CaskFlattenConvolution[0x80000036])
[12/14/2023-17:14:23] [V] [TRT] CaskFlattenConvolution has no valid tactics for this config, skipping
[12/14/2023-17:14:23] [V] [TRT] >>>>>>>>>>>>>>> Chose Runner Type: CaskConvolution Tactic: 0x62835fce994f06dd
[12/14/2023-17:14:23] [V] [TRT] *************** Autotuning format combination: Float(2592000,1:4,7200,20) -> Float(2592000,32400,180,1) ***************
[12/14/2023-17:14:23] [V] [TRT] --------------- Timing Runner: Conv_2 + Relu_3 (CaskConvolution[0x80000009])
[12/14/2023-17:14:23] [V] [TRT] Tactic Name: sm80_xmma_fprop_implicit_gemm_f32f32_tf32f32_f32_nhwckrsc_nchw_tilesize128x128x16_stage4_warpsize2x2x1_g1_tensor16x8x8_t1r3s3 Tactic: 0x9787b83bedcff6a2 Time: 0.228791
[12/14/2023-17:14:23] [V] [TRT] Tactic Name: sm80_xmma_fprop_implicit_gemm_indexed_f32f32_tf32f32_f32_nhwckrsc_nchw_tilesize128x128x16_stage4_warpsize2x2x1_g1_tensor16x8x8_alignc4 Tactic: 0xe8f7b6a5bab325f8 Time: 0.24064
[12/14/2023-17:14:23] [V] [TRT] Tactic Name: sm80_xmma_fprop_implicit_gemm_f32f32_tf32f32_f32_nhwckrsc_nchw_tilesize128x128x16_stage4_warpsize2x2x1_g1_tensor16x8x8_alignc4 Tactic: 0x9fd9fe001908ce2e Time: 0.231424
[12/14/2023-17:14:23] [V] [TRT] Tactic Name: sm80_xmma_fprop_implicit_gemm_indexed_f32f32_tf32f32_f32_nhwckrsc_nchw_tilesize128x128x16_stage4_warpsize2x2x1_g1_tensor16x8x8 Tactic: 0xe0a307ffe0ffb6a5 Time: 0.233765
[12/14/2023-17:14:23] [V] [TRT] Tactic Name: sm80_xmma_fprop_implicit_gemm_f32f32_tf32f32_f32_nhwckrsc_nchw_tilesize128x128x16_stage4_warpsize2x2x1_g1_tensor16x8x8_t1r3s3_alignc4 Tactic: 0x1323e48791e2f671 Time: 0.223086
[12/14/2023-17:14:23] [V] [TRT] Tactic Name: sm80_xmma_fprop_implicit_gemm_f32f32_tf32f32_f32_nhwckrsc_nchw_tilesize128x128x16_stage4_warpsize2x2x1_g1_tensor16x8x8 Tactic: 0x3104d85fecdd547c Time: 0.225134
[12/14/2023-17:14:23] [V] [TRT] Conv_2 + Relu_3 (CaskConvolution[0x80000009]) profiling completed in 0.0244713 seconds. Fastest Tactic: 0x1323e48791e2f671 Time: 0.223086
[12/14/2023-17:14:23] [V] [TRT] --------------- Timing Runner: Conv_2 + Relu_3 (CaskFlattenConvolution[0x80000036])
[12/14/2023-17:14:23] [V] [TRT] CaskFlattenConvolution has no valid tactics for this config, skipping
[12/14/2023-17:14:23] [V] [TRT] >>>>>>>>>>>>>>> Chose Runner Type: CaskConvolution Tactic: 0x1323e48791e2f671
[12/14/2023-17:14:23] [V] [TRT] *************** Autotuning format combination: Float(2592000,1:4,7200,20) -> Float(648000,1:4,3600,20) ***************
[12/14/2023-17:14:23] [V] [TRT] --------------- Timing Runner: Conv_2 + Relu_3 (CaskConvolution[0x80000009])
[12/14/2023-17:14:23] [V] [TRT] Tactic Name: ampere_scudnn_128x32_sliced1x4_ldg4_relu_exp_small_nhwc_tn_v1 Tactic: 0x3e2b881168d9689d Time: 0.364251
[12/14/2023-17:14:23] [V] [TRT] Tactic Name: ampere_scudnn_128x128_ldg4_relu_exp_medium_nhwc_tn_v1 Tactic: 0x7bc32c782b800c48 Time: 0.404773
[12/14/2023-17:14:23] [V] [TRT] Tactic Name: ampere_scudnn_128x64_sliced1x2_ldg4_relu_exp_large_nhwc_tn_v1 Tactic: 0xbdfdef6b84f7ccc9 Time: 0.369518
[12/14/2023-17:14:23] [V] [TRT] Tactic Name: ampere_scudnn_128x128_ldg4_relu_exp_small_nhwc_tn_v1 Tactic: 0xf90060ce8193b811 Time: 0.401993
[12/14/2023-17:14:23] [V] [TRT] Tactic Name: sm80_xmma_fprop_implicit_gemm_f32f32_tf32f32_f32_nhwckrsc_nhwc_tilesize128x128x16_stage4_warpsize2x2x1_g1_tensor16x8x8 Tactic: 0xb443c221fcb1565b Time: 0.223232
[12/14/2023-17:14:23] [V] [TRT] Tactic Name: sm80_xmma_fprop_implicit_gemm_f32f32_tf32f32_f32_nhwckrsc_nhwc_tilesize128x128x16_stage4_warpsize2x2x1_g1_tensor16x8x8_t1r3s3 Tactic: 0x999e005e3b016ea6 Time: 0.22016
[12/14/2023-17:14:23] [V] [TRT] Tactic Name: sm80_xmma_fprop_implicit_gemm_indexed_f32f32_tf32f32_f32_nhwckrsc_nhwc_tilesize128x128x16_stage4_warpsize2x2x1_g1_tensor16x8x8 Tactic: 0x65e41d81f093b482 Time: 0.2304
[12/14/2023-17:14:23] [V] [TRT] Conv_2 + Relu_3 (CaskConvolution[0x80000009]) profiling completed in 0.0345325 seconds. Fastest Tactic: 0x999e005e3b016ea6 Time: 0.22016
[12/14/2023-17:14:23] [V] [TRT] --------------- Timing Runner: Conv_2 + Relu_3 (CaskFlattenConvolution[0x80000036])
[12/14/2023-17:14:23] [V] [TRT] CaskFlattenConvolution has no valid tactics for this config, skipping
[12/14/2023-17:14:23] [V] [TRT] >>>>>>>>>>>>>>> Chose Runner Type: CaskConvolution Tactic: 0x999e005e3b016ea6
[12/14/2023-17:14:23] [V] [TRT] *************** Autotuning format combination: Half(10368000,129600,360,1) -> Half(2592000,32400,180,1) ***************
[12/14/2023-17:14:23] [V] [TRT] --------------- Timing Runner: Conv_2 + Relu_3 (CaskConvolution[0x80000009])
[12/14/2023-17:14:23] [V] [TRT] CaskConvolution has no valid tactics for this config, skipping
[12/14/2023-17:14:23] [V] [TRT] --------------- Timing Runner: Conv_2 + Relu_3 (CudnnConvolution[0x80000000])
[12/14/2023-17:14:23] [V] [TRT] CudnnConvolution has no valid tactics for this config, skipping
[12/14/2023-17:14:23] [V] [TRT] --------------- Timing Runner: Conv_2 + Relu_3 (CaskFlattenConvolution[0x80000036])
[12/14/2023-17:14:23] [V] [TRT] CaskFlattenConvolution has no valid tactics for this config, skipping
[12/14/2023-17:14:23] [V] [TRT] *************** Autotuning format combination: Half(5184000,1:2,14400,40) -> Half(1296000,1:2,7200,40) ***************
[12/14/2023-17:14:23] [V] [TRT] --------------- Timing Runner: Conv_2 + Relu_3 (CaskConvolution[0x80000009])
[12/14/2023-17:14:23] [V] [TRT] CaskConvolution has no valid tactics for this config, skipping
[12/14/2023-17:14:23] [V] [TRT] --------------- Timing Runner: Conv_2 + Relu_3 (CaskFlattenConvolution[0x80000036])
[12/14/2023-17:14:23] [V] [TRT] CaskFlattenConvolution has no valid tactics for this config, skipping
[12/14/2023-17:14:23] [V] [TRT] *************** Autotuning format combination: Half(2592000,1:4,7200,20) -> Half(648000,1:4,3600,20) ***************
[12/14/2023-17:14:23] [V] [TRT] --------------- Timing Runner: Conv_2 + Relu_3 (CaskConvolution[0x80000009])
[12/14/2023-17:14:23] [V] [TRT] CaskConvolution has no valid tactics for this config, skipping
[12/14/2023-17:14:23] [V] [TRT] --------------- Timing Runner: Conv_2 + Relu_3 (CaskFlattenConvolution[0x80000036])
[12/14/2023-17:14:23] [V] [TRT] CaskFlattenConvolution has no valid tactics for this config, skipping
[12/14/2023-17:14:23] [V] [TRT] *************** Autotuning format combination: Half(1296000,1:8,3600,10) -> Float(2592000,32400,180,1) ***************
[12/14/2023-17:14:23] [V] [TRT] --------------- Timing Runner: Conv_2 + Relu_3 (CaskConvolution[0x80000009])
[12/14/2023-17:14:23] [V] [TRT] CaskConvolution has no valid tactics for this config, skipping
[12/14/2023-17:14:23] [V] [TRT] --------------- Timing Runner: Conv_2 + Relu_3 (CaskFlattenConvolution[0x80000036])
[12/14/2023-17:14:23] [V] [TRT] CaskFlattenConvolution has no valid tactics for this config, skipping
[12/14/2023-17:14:23] [V] [TRT] *************** Autotuning format combination: Half(1296000,1:8,3600,10) -> Half(324000,1:8,1800,10) ***************
[12/14/2023-17:14:23] [V] [TRT] --------------- Timing Runner: Conv_2 + Relu_3 (CaskConvolution[0x80000009])
[12/14/2023-17:14:23] [V] [TRT] Tactic Name: sm80_xmma_fprop_implicit_gemm_indexed_f16f16_f16f16_f16_nhwckrsc_nhwc_tilesize256x32x32_stage4_warpsize4x1x1_g1_tensor16x8x16 Tactic: 0xdce100b9fe609424 Time: 0.086016
[12/14/2023-17:14:23] [V] [TRT] Tactic Name: sm80_xmma_fprop_implicit_gemm_f16f16_f16f16_f16_nhwckrsc_nhwc_tilesize128x256x32_stage3_warpsize2x4x1_g1_tensor16x8x16_t1r3s3 Tactic: 0xa9177bbe4e767df8 Time: 0.144434
[12/14/2023-17:14:23] [V] [TRT] Tactic Name: sm80_xmma_fprop_implicit_gemm_f16f16_f16f16_f16_nhwckrsc_nhwc_tilesize128x64x64_stage3_warpsize2x2x1_g1_tensor16x8x16_t1r3s3 Tactic: 0x05b6220f243edacd Time: 0.0988229
[12/14/2023-17:14:23] [V] [TRT] Tactic Name: sm80_xmma_fprop_implicit_gemm_f16f16_f16f16_f16_nhwckrsc_nhwc_tilesize256x128x32_stage3_warpsize4x2x1_g1_tensor16x8x16 Tactic: 0x60da8c7151d91e47 Time: 0.126098
[12/14/2023-17:14:23] [V] [TRT] Tactic Name: sm80_xmma_fprop_implicit_gemm_f16f16_f16f16_f16_nhwckrsc_nhwc_tilesize128x128x32_stage4_warpsize2x2x1_g1_tensor16x8x16 Tactic: 0xdfa020ef435ef810 Time: 0.095232
[12/14/2023-17:14:23] [V] [TRT] Tactic Name: sm80_xmma_fprop_implicit_gemm_f16f16_f16f16_f16_nhwckrsc_nhwc_tilesize128x64x64_stage3_warpsize2x2x1_g1_tensor16x8x16 Tactic: 0x5568fd8a32f4a40f Time: 0.0999863
[12/14/2023-17:14:23] [V] [TRT] Tactic Name: sm80_xmma_fprop_implicit_gemm_f16f16_f16f16_f16_nhwckrsc_nhwc_tilesize128x128x64_stage3_warpsize2x2x1_g1_tensor16x8x16_t1r3s3 Tactic: 0xc0a02dc6095497cc Time: 0.106496
[12/14/2023-17:14:23] [V] [TRT] Tactic Name: sm80_xmma_fprop_implicit_gemm_f16f16_f16f16_f16_nhwckrsc_nhwc_tilesize128x64x32_stage5_warpsize2x2x1_g1_tensor16x8x16_t1r3s3 Tactic: 0xb4bec086187edcfc Time: 0.0858194
[12/14/2023-17:14:23] [V] [TRT] Tactic Name: sm80_xmma_fprop_implicit_gemm_f16f16_f16f16_f16_nhwckrsc_nhwc_tilesize128x128x64_stage3_warpsize2x2x1_g1_tensor16x8x16 Tactic: 0x57c9a5ff682354a6 Time: 0.10752
[12/14/2023-17:14:23] [V] [TRT] Tactic Name: sm80_xmma_fprop_implicit_gemm_f16f16_f16f16_f16_nhwckrsc_nhwc_tilesize64x128x32_stage5_warpsize2x2x1_g1_tensor16x8x16 Tactic: 0xdb0b80f591d1bb6d Time: 0.0847726
[12/14/2023-17:14:23] [V] [TRT] Tactic Name: sm80_xmma_fprop_implicit_gemm_f16f16_f16f16_f16_nhwckrsc_nhwc_tilesize64x64x64_stage4_warpsize2x2x1_g1_tensor16x8x16_t1r3s3 Tactic: 0x31d93dc22d2af081 Time: 0.11381
[12/14/2023-17:14:23] [V] [TRT] Tactic Name: sm80_xmma_fprop_implicit_gemm_f16f16_f16f16_f16_nhwckrsc_nhwc_tilesize64x32x64_stage5_warpsize2x2x1_g1_tensor16x8x16 Tactic: 0x5820b3dda403c4d0 Time: 0.13245
[12/14/2023-17:14:23] [V] [TRT] Tactic Name: sm80_xmma_fprop_implicit_gemm_indexed_f16f16_f16f16_f16_nhwckrsc_nhwc_tilesize256x128x32_stage3_warpsize4x2x1_g1_tensor16x8x16 Tactic: 0xb17d53d15dfbfc9e Time: 0.127122
[12/14/2023-17:14:23] [V] [TRT] Tactic Name: sm80_xmma_fprop_implicit_gemm_indexed_f16f16_f16f16_f16_nhwckrsc_nhwc_tilesize128x64x64_stage3_warpsize2x2x1_g1_tensor16x8x16 Tactic: 0x21b295c0c8f6c95a Time: 0.10067
[12/14/2023-17:14:23] [V] [TRT] Tactic Name: sm80_xmma_fprop_implicit_gemm_indexed_f16f16_f16f16_f16_nhwckrsc_nhwc_tilesize64x32x64_stage5_warpsize2x2x1_g1_tensor16x8x16 Tactic: 0xe1ff5ad20f5c6bf6 Time: 0.131902
[12/14/2023-17:14:23] [V] [TRT] Tactic Name: sm80_xmma_fprop_implicit_gemm_f16f16_f16f16_f16_nhwckrsc_nhwc_tilesize128x64x32_stage5_warpsize2x2x1_g1_tensor16x8x16 Tactic: 0xbd08239a9317f2fd Time: 0.0869623
[12/14/2023-17:14:23] [V] [TRT] Tactic Name: sm80_xmma_fprop_implicit_gemm_f16f16_f16f16_f16_nhwckrsc_nhwc_tilesize256x64x32_stage3_warpsize4x1x1_g1_tensor16x8x16_t1r3s3_aACCESS Tactic: 0x0866ddee325d07a6 Time: 0.0991337
[12/14/2023-17:14:23] [V] [TRT] Tactic Name: sm80_xmma_fprop_implicit_gemm_indexed_f16f16_f16f16_f16_nhwckrsc_nhwc_tilesize256x64x32_stage3_warpsize4x1x1_g1_tensor16x8x16 Tactic: 0xa570c55d303796ff Time: 0.099328
[12/14/2023-17:14:23] [V] [TRT] Tactic Name: sm80_xmma_fprop_implicit_gemm_indexed_f16f16_f16f16_f16_nhwckrsc_nhwc_tilesize64x64x64_stage4_warpsize2x2x1_g1_tensor16x8x16 Tactic: 0x4a81ea1e51436a30 Time: 0.112201
[12/14/2023-17:14:23] [V] [TRT] Tactic Name: sm80_xmma_fprop_implicit_gemm_indexed_f16f16_f16f16_f16_nhwckrsc_nhwc_tilesize128x128x32_stage4_warpsize2x2x1_g1_tensor16x8x16 Tactic: 0x0e07ff4f4f7c1ac9 Time: 0.0966217
[12/14/2023-17:14:23] [V] [TRT] Tactic Name: sm80_xmma_fprop_implicit_gemm_indexed_f16f16_f16f16_f16_nhwckrsc_nhwc_tilesize128x64x32_stage5_warpsize2x2x1_g1_tensor16x8x16 Tactic: 0xc9d24bd069159fa8 Time: 0.0934766
[12/14/2023-17:14:23] [V] [TRT] Tactic Name: sm80_xmma_fprop_implicit_gemm_f16f16_f16f16_f16_nhwckrsc_nhwc_tilesize128x128x32_stage4_warpsize2x2x1_g1_tensor16x8x16_t1r3s3 Tactic: 0x60c3421152ef8e10 Time: 0.094128
[12/14/2023-17:14:23] [V] [TRT] Tactic Name: sm80_xmma_fprop_implicit_gemm_f16f16_f16f16_f16_nhwckrsc_nhwc_tilesize128x256x32_stage3_warpsize2x4x1_g1_tensor16x8x16 Tactic: 0xa1a20ea714d420f4 Time: 0.144969
[12/14/2023-17:14:23] [V] [TRT] Tactic Name: sm80_xmma_fprop_implicit_gemm_indexed_f16f16_f16f16_f16_nhwckrsc_nhwc_tilesize128x32x32_stage4_warpsize4x1x1_g1_tensor16x8x16 Tactic: 0xf79479a62ea9f901 Time: 0.0873737
[12/14/2023-17:14:23] [V] [TRT] Tactic Name: sm80_xmma_fprop_implicit_gemm_f16f16_f16f16_f16_nhwckrsc_nhwc_tilesize256x32x32_stage4_warpsize4x1x1_g1_tensor16x8x16 Tactic: 0xa83b68f30462f971 Time: 0.0862354
[12/14/2023-17:14:23] [V] [TRT] Tactic Name: sm80_xmma_fprop_implicit_gemm_f16f16_f16f16_f16_nhwckrsc_nhwc_tilesize128x32x32_stage4_warpsize4x1x1_g1_tensor16x8x16 Tactic: 0x834e11ecd4ab9454 Time: 0.0874057
[12/14/2023-17:14:23] [V] [TRT] Tactic Name: sm80_xmma_fprop_implicit_gemm_indexed_f16f16_f16f16_f16_nhwckrsc_nhwc_tilesize128x256x32_stage3_warpsize2x4x1_g1_tensor16x8x16 Tactic: 0x7005d10718f6c22d Time: 0.146871
[12/14/2023-17:14:23] [V] [TRT] Tactic Name: sm80_xmma_fprop_implicit_gemm_f16f16_f16f16_f16_nhwckrsc_nhwc_tilesize256x64x32_stage3_warpsize4x1x1_g1_tensor16x8x16 Tactic: 0xd1aaad17ca35fbaa Time: 0.0972846
[12/14/2023-17:14:23] [V] [TRT] Tactic Name: sm80_xmma_fprop_implicit_gemm_f16f16_f16f16_f16_nhwckrsc_nhwc_tilesize128x128x32_stage4_warpsize2x2x1_g1_tensor16x8x16_t1r3s3_aACCESS Tactic: 0x245530c34bd6090f Time: 0.093184
[12/14/2023-17:14:23] [V] [TRT] Tactic Name: sm80_xmma_fprop_implicit_gemm_f16f16_f16f16_f16_nhwckrsc_nhwc_tilesize64x64x64_stage4_warpsize2x1x2_g1_tensor16x8x16_aACCESS Tactic: 0x841c601dec2a75bc Time: 0.104229
[12/14/2023-17:14:23] [V] [TRT] Tactic Name: sm80_xmma_fprop_implicit_gemm_f16f16_f16f16_f16_nhwckrsc_nhwc_tilesize64x64x64_stage4_warpsize2x2x1_g1_tensor16x8x16_t1r3s3_aACCESS Tactic: 0x30e8a8d7a953e5e9 Time: 0.110446
[12/14/2023-17:14:23] [V] [TRT] Tactic Name: sm80_xmma_fprop_implicit_gemm_f16f16_f16f16_f16_nhwckrsc_nhwc_tilesize256x128x32_stage3_warpsize4x2x1_g1_tensor16x8x16_t1r3s3 Tactic: 0x048d6d0400f33439 Time: 0.125998
[12/14/2023-17:14:23] [V] [TRT] Tactic Name: sm80_xmma_fprop_implicit_gemm_f16f16_f16f16_f16_nhwckrsc_nhwc_tilesize64x64x64_stage4_warpsize2x2x1_g1_tensor16x8x16 Tactic: 0xf35e0311fa1cc516 Time: 0.113006
[12/14/2023-17:14:23] [V] [TRT] Tactic Name: sm80_xmma_fprop_implicit_gemm_f16f16_f16f16_f16_nhwckrsc_nhwc_tilesize256x64x32_stage3_warpsize4x1x1_g1_tensor16x8x16_t1r3s3 Tactic: 0x529f4431bdae94f5 Time: 0.0969874
[12/14/2023-17:14:23] [V] [TRT] Tactic Name: sm80_xmma_fprop_implicit_gemm_f16f16_f16f16_f16_nhwckrsc_nhwc_tilesize256x32x32_stage4_warpsize4x1x1_g1_tensor16x8x16_t1r3s3 Tactic: 0xa40cb43c296a36a8 Time: 0.0855817
[12/14/2023-17:14:23] [V] [TRT] Tactic Name: sm80_xmma_fprop_implicit_gemm_f16f16_f16f16_f16_nhwckrsc_nhwc_tilesize128x32x32_stage4_warpsize4x1x1_g1_tensor16x8x16_t1r3s3 Tactic: 0x3e7eb35b91b9fa63 Time: 0.0858697
[12/14/2023-17:14:23] [V] [TRT] Tactic Name: sm80_xmma_fprop_implicit_gemm_f16f16_f16f16_f16_nhwckrsc_nhwc_tilesize128x64x64_stage4_warpsize2x1x2_g1_tensor16x8x16 Tactic: 0x7273dde1d0cd3bd5 Time: 0.100791
[12/14/2023-17:14:23] [V] [TRT] Tactic Name: sm80_xmma_fprop_implicit_gemm_f16f16_f16f16_f16_nhwckrsc_nhwc_tilesize64x128x32_stage5_warpsize2x2x1_g1_tensor16x8x16_t1r3s3 Tactic: 0x17ebf0c9f418f10a Time: 0.0833829
[12/14/2023-17:14:23] [V] [TRT] Tactic Name: sm80_xmma_fprop_implicit_gemm_f16f16_f16f16_f16_nhwckrsc_nhwc_tilesize128x64x64_stage3_warpsize2x2x1_g1_tensor16x8x16_t1r3s3_aACCESS Tactic: 0x263a38afd75e3a43 Time: 0.104448
[12/14/2023-17:14:23] [V] [TRT] Tactic Name: sm80_xmma_fprop_implicit_gemm_indexed_f16f16_f16f16_f16_nhwckrsc_nhwc_tilesize64x128x32_stage5_warpsize2x2x1_g1_tensor16x8x16 Tactic: 0xafd1e8bf6bd3d638 Time: 0.0847726
[12/14/2023-17:14:23] [V] [TRT] Tactic Name: sm80_xmma_fprop_implicit_gemm_f16f16_f16f16_f16_nhwckrsc_nhwc_tilesize64x32x64_stage5_warpsize2x2x1_g1_tensor16x8x16_t1r3s3 Tactic: 0xa033e20ae9f412b2 Time: 0.128793
[12/14/2023-17:14:23] [V] [TRT] Tactic Name: sm80_xmma_fprop_implicit_gemm_indexed_f16f16_f16f16_f16_nhwckrsc_nhwc_tilesize128x128x64_stage3_warpsize2x2x1_g1_tensor16x8x16 Tactic: 0x866e7a5f6401b67f Time: 0.106862
[12/14/2023-17:14:23] [V] [TRT] Conv_2 + Relu_3 (CaskConvolution[0x80000009]) profiling completed in 0.13054 seconds. Fastest Tactic: 0x17ebf0c9f418f10a Time: 0.0833829
[12/14/2023-17:14:23] [V] [TRT] --------------- Timing Runner: Conv_2 + Relu_3 (CaskFlattenConvolution[0x80000036])
[12/14/2023-17:14:23] [V] [TRT] CaskFlattenConvolution has no valid tactics for this config, skipping
[12/14/2023-17:14:23] [V] [TRT] >>>>>>>>>>>>>>> Chose Runner Type: CaskConvolution Tactic: 0x17ebf0c9f418f10a
[12/14/2023-17:14:23] [V] [TRT] =============== Computing costs for 
[12/14/2023-17:14:23] [V] [TRT] *************** Autotuning format combination: Float(2592000,32400,180,1) -> Float(2592000,32400,180,1) ***************
[12/14/2023-17:14:23] [V] [TRT] --------------- Timing Runner: Conv_4 + Relu_5 (CaskConvolution[0x80000009])
[12/14/2023-17:14:23] [V] [TRT] Tactic Name: ampere_scudnn_128x128_relu_medium_nn_v1 Tactic: 0xf067e6205da31c2e Time: 0.492928
[12/14/2023-17:14:23] [V] [TRT] Tactic Name: ampere_scudnn_128x128_relu_small_nn_v1 Tactic: 0x503619c69ae500ff Time: 0.467237
[12/14/2023-17:14:23] [V] [TRT] Tactic Name: ampere_scudnn_128x64_relu_xregs_large_nn_v1 Tactic: 0x5deb29b7a8e275f7 Time: 0.454802
[12/14/2023-17:14:23] [V] [TRT] Tactic Name: ampere_scudnn_128x64_relu_small_nn_v1 Tactic: 0x3f243c490d502deb Time: 0.516096
[12/14/2023-17:14:23] [V] [TRT] Tactic Name: sm80_xmma_fprop_implicit_gemm_indexed_f32f32_f32f32_f32_nchwkcrs_nchw_tilesize128x64x8_stage2_warpsize1x4x1_g1_ffma_aligna4_alignc4_beta0_packed_stride Tactic: 0xede36641840ce3d2 Time: 0.513317
[12/14/2023-17:14:23] [V] [TRT] Tactic Name: sm80_xmma_fprop_implicit_gemm_indexed_f32f32_f32f32_f32_nchwkcrs_nchw_tilesize128x32x8_stage3_warpsize2x2x1_g1_ffma_aligna4_alignc4 Tactic: 0xa9366041633a5135 Time: 0.563493
[12/14/2023-17:14:23] [V] [TRT] Tactic Name: sm50_xmma_conv_fprop_fused_conv_act_fp32_NCHW_fp32_NCHW_KCRS_fp32_fp32_fp32_Accfloat_1_1_cC1_dC1_srcVec1_fltVec2_2_TP5_TQ5_C1_R3_S3_U1_V1 Tactic: 0x4165f9dd71b6e38a Time: 0.541696
[12/14/2023-17:14:23] [V] [TRT] Tactic Name: sm50_xmma_conv_fprop_fused_conv_act_fp32_NCHW_fp32_NCHW_KCRS_fp32_fp32_fp32_Accfloat_1_1_cC1_dC1_srcVec1_fltVec2_2_TP4_TQ7_C4_R3_S3_U1_V1 Tactic: 0x753397072379d6e9 Time: 0.565248
[12/14/2023-17:14:23] [V] [TRT] Tactic Name: sm80_xmma_fprop_implicit_gemm_indexed_f32f32_f32f32_f32_nchwkcrs_nchw_tilesize128x64x8_stage2_warpsize4x1x1_g1_ffma_aligna4_alignc4_beta0_packed_stride Tactic: 0x1673e3594ce11cea Time: 0.528814
[12/14/2023-17:14:23] [V] [TRT] Tactic Name: sm80_xmma_fprop_wngd_f32f32_f32_f32_nchwkcrs_nchw_tilesize8x16x32x8_warpsize8x1x1_wngd2x2 Tactic: 0xe47e164f4a743900 Time: 0.179785
[12/14/2023-17:14:23] [V] [TRT] Tactic Name: sm50_xmma_conv_fprop_fused_conv_act_fp32_NCHW_fp32_NCHW_KCRS_fp32_fp32_fp32_Accfloat_1_1_cC1_dC1_srcVec1_fltVec2_2_TP7_TQ4_C1_R3_S3_U1_V1 Tactic: 0xe2f49879bec27b91 Time: 0.965339
[12/14/2023-17:14:23] [V] [TRT] Tactic Name: sm50_xmma_conv_fprop_fused_conv_act_fp32_NCHW_fp32_NCHW_KCRS_fp32_fp32_fp32_Accfloat_1_1_cC1_dC1_srcVec1_fltVec1_1_TP7_TQ5_C1_R3_S3_U1_V1 Tactic: 0x5ac6bfe0a27fc97b Time: 0.970171
[12/14/2023-17:14:23] [V] [TRT] Tactic Name: sm50_xmma_conv_fprop_fused_conv_act_fp32_NCHW_fp32_NCHW_KCRS_fp32_fp32_fp32_Accfloat_1_1_cC1_dC1_srcVec1_fltVec2_2_TP4_TQ8_C1_R3_S3_U1_V1 Tactic: 0x36209b75daa96278 Time: 0.852114
[12/14/2023-17:14:23] [V] [TRT] Tactic Name: sm50_xmma_conv_fprop_fused_conv_act_fp32_NCHW_fp32_NCHW_KCRS_fp32_fp32_fp32_Accfloat_1_1_cC1_dC1_srcVec1_fltVec2_2_TP5_TQ7_C8_R3_S3_U1_V1 Tactic: 0x688222fe126a1c16 Time: 0.642743
[12/14/2023-17:14:23] [V] [TRT] Tactic Name: sm50_xmma_conv_fprop_fused_conv_act_fp32_NCHW_fp32_NCHW_KCRS_fp32_fp32_fp32_Accfloat_1_1_cC1_dC1_srcVec2_fltVec1_1_TP6_TQ8_C8_R3_S3_U1_V1 Tactic: 0xee473898b5318f6e Time: 0.247223
[12/14/2023-17:14:23] [V] [TRT] Tactic Name: sm80_xmma_fprop_implicit_gemm_indexed_f32f32_f32f32_f32_nchwkcrs_nchw_tilesize32x32x8_stage3_warpsize1x2x1_g1_ffma_aligna4_alignc4 Tactic: 0xcb8a43f748d8a338 Time: 0.570661
[12/14/2023-17:14:23] [V] [TRT] Tactic Name: sm50_xmma_conv_fprop_fused_conv_act_fp32_NCHW_fp32_NCHW_KCRS_fp32_fp32_fp32_Accfloat_1_1_cC1_dC1_srcVec1_fltVec1_1_TP4_TQ7_C2_R3_S3_U1_V1 Tactic: 0x57c1b87347e45486 Time: 0.623031
[12/14/2023-17:14:23] [V] [TRT] Tactic Name: sm80_xmma_fprop_implicit_gemm_f32f32_f32f32_f32_nchwkcrs_nchw_tilesize64x128x8_stage3_warpsize1x4x1_g1_ffma_aligna4_alignc4 Tactic: 0x5aa723e0481da855 Time: 0.476891
[12/14/2023-17:14:23] [V] [TRT] Tactic Name: sm80_xmma_fprop_implicit_gemm_f32f32_f32f32_f32_nchwkcrs_nchw_tilesize128x64x8_stage2_warpsize1x4x1_g1_ffma_t1r3s3_aligna4_alignc4_beta0_packed_stride Tactic: 0x7fc93550f5b9c127 Time: 0.490496
[12/14/2023-17:14:23] [V] [TRT] Tactic Name: sm50_xmma_conv_fprop_fused_conv_act_fp32_NCHW_fp32_NCHW_KCRS_fp32_fp32_fp32_Accfloat_1_1_cC1_dC1_srcVec2_fltVec1_1_TP7_TQ8_C8_R3_S3_U1_V1 Tactic: 0x06cd3594e0105153 Time: 0.24459
[12/14/2023-17:14:23] [V] [TRT] Tactic Name: sm80_xmma_fprop_implicit_gemm_indexed_f32f32_f32f32_f32_nchwkcrs_nchw_tilesize128x16x8_stage3_warpsize4x1x1_g1_ffma_aligna4_alignc4 Tactic: 0x40a12e3938221818 Time: 0.679461
[12/14/2023-17:14:23] [V] [TRT] Tactic Name: sm80_xmma_fprop_implicit_gemm_f32f32_f32f32_f32_nchwkcrs_nchw_tilesize64x128x8_stage3_warpsize1x4x1_g1_ffma_t1r3s3_aligna4_alignc4 Tactic: 0x01cf8ce2da913006 Time: 0.458898
[12/14/2023-17:14:23] [V] [TRT] Tactic Name: sm80_xmma_fprop_implicit_gemm_f32f32_f32f32_f32_nchwkcrs_nchw_tilesize32x32x8_stage3_warpsize1x2x1_g1_ffma_aligna4_alignc4 Tactic: 0xb0bf940d5e0f9f45 Time: 0.490203
[12/14/2023-17:14:23] [V] [TRT] Tactic Name: sm80_xmma_fprop_implicit_gemm_indexed_f32f32_f32f32_f32_nchwkcrs_nchw_tilesize64x64x8_stage3_warpsize1x4x1_g1_ffma_aligna4_alignc4 Tactic: 0xd828f024626fa982 Time: 0.517705
[12/14/2023-17:14:23] [V] [TRT] Tactic Name: sm50_xmma_conv_fprop_fused_conv_act_fp32_NCHW_fp32_NCHW_KCRS_fp32_fp32_fp32_Accfloat_1_1_cC1_dC1_srcVec1_fltVec2_2_TP6_TQ5_C2_R3_S3_U1_V1 Tactic: 0x1e01f84aaf51153a Time: 0.592311
[12/14/2023-17:14:23] [V] [TRT] Tactic Name: sm80_xmma_fprop_implicit_gemm_indexed_f32f32_f32f32_f32_nchwkcrs_nchw_tilesize128x64x8_stage2_warpsize2x2x1_g1_ffma_aligna4_alignc4_beta0_packed_stride Tactic: 0x31aa67f57c5aea77 Time: 0.492827
[12/14/2023-17:14:23] [V] [TRT] Tactic Name: sm50_xmma_conv_fprop_fused_conv_act_fp32_NCHW_fp32_NCHW_KCRS_fp32_fp32_fp32_Accfloat_1_1_cC1_dC1_srcVec1_fltVec1_1_TP7_TQ8_C4_R3_S3_U1_V1 Tactic: 0x4bb6b59660d316a7 Time: 0.535991
[12/14/2023-17:14:23] [V] [TRT] Tactic Name: sm50_xmma_conv_fprop_fused_conv_act_fp32_NCHW_fp32_NCHW_KCRS_fp32_fp32_fp32_Accfloat_1_1_cC1_dC1_srcVec1_fltVec4_4_TP4_TQ5_C2_R3_S3_U1_V1 Tactic: 0xed12ab640715a7d9 Time: 0.454802
[12/14/2023-17:14:23] [V] [TRT] Tactic Name: sm80_xmma_fprop_implicit_gemm_f32f32_f32f32_f32_nchwkcrs_nchw_tilesize128x16x8_stage3_warpsize4x1x1_g1_ffma_aligna4_alignc4 Tactic: 0x9d9fdb5fd9945f64 Time: 0.441637
[12/14/2023-17:14:23] [V] [TRT] Tactic Name: sm80_xmma_fprop_implicit_gemm_f32f32_f32f32_f32_nchwkcrs_nchw_tilesize256x128x8_stage3_warpsize4x2x1_g1_ffma_t1r3s3_aligna4_alignc4 Tactic: 0x4efce38acc876f5c Time: 0.439589
[12/14/2023-17:14:23] [V] [TRT] Tactic Name: sm50_xmma_conv_fprop_fused_conv_act_fp32_NCHW_fp32_NCHW_KCRS_fp32_fp32_fp32_Accfloat_1_1_cC1_dC1_srcVec1_fltVec4_4_TP4_TQ5_C1_R3_S3_U1_V1 Tactic: 0x193012cc899e2dab Time: 0.528677
[12/14/2023-17:14:23] [V] [TRT] Tactic Name: sm80_xmma_fprop_implicit_gemm_f32f32_f32f32_f32_nchwkcrs_nchw_tilesize64x64x8_stage3_warpsize1x4x1_g1_ffma_t1r3s3_aligna4_alignc4 Tactic: 0x4727434768e46395 Time: 0.511415
[12/14/2023-17:14:23] [V] [TRT] Tactic Name: sm80_xmma_fprop_wngd_f32f32_f32_f32_nchwkcrs_nchw_tilesize8x16x16x8_warpsize8x1x1_wngd2x2 Tactic: 0xe38e9dfd56c33779 Time: 0.153893
[12/14/2023-17:14:23] [V] [TRT] Tactic Name: sm50_xmma_conv_fprop_fused_conv_act_fp32_NCHW_fp32_NCHW_KCRS_fp32_fp32_fp32_Accfloat_1_1_cC1_dC1_srcVec1_fltVec1_1_TP8_TQ7_C4_R3_S3_U1_V1 Tactic: 0x372f7588455e8e60 Time: 0.514217
[12/14/2023-17:14:23] [V] [TRT] Tactic Name: sm50_xmma_conv_fprop_fused_conv_act_fp32_NCHW_fp32_NCHW_KCRS_fp32_fp32_fp32_Accfloat_1_1_cC1_dC1_srcVec1_fltVec1_1_TP5_TQ7_C2_R3_S3_U1_V1 Tactic: 0xbf4bb57f12c58abb Time: 0.625431
[12/14/2023-17:14:23] [V] [TRT] Tactic Name: sm50_xmma_conv_fprop_fused_conv_act_fp32_NCHW_fp32_NCHW_KCRS_fp32_fp32_fp32_Accfloat_1_1_cC1_dC1_srcVec1_fltVec2_2_TP4_TQ7_C1_R3_S3_U1_V1 Tactic: 0xfb8cf2d51feb56fa Time: 0.910629
[12/14/2023-17:14:23] [V] [TRT] Tactic Name: sm50_xmma_conv_fprop_fused_conv_act_fp32_NCHW_fp32_NCHW_KCRS_fp32_fp32_fp32_Accfloat_1_1_cC1_dC1_srcVec1_fltVec2_2_TP4_TQ8_C2_R3_S3_U1_V1 Tactic: 0xc20222dd5422e80a Time: 0.593042
[12/14/2023-17:14:23] [V] [TRT] Tactic Name: sm50_xmma_conv_fprop_fused_conv_act_fp32_NCHW_fp32_NCHW_KCRS_fp32_fp32_fp32_Accfloat_1_1_cC1_dC1_srcVec1_fltVec1_1_TP8_TQ5_C2_R3_S3_U1_V1 Tactic: 0x1fd1aff6cc3bef4c Time: 0.799305
