src/object_detection/model/resnet50int8/build/head.bbox.log
[12/14/2023-21:07:51] [V] [TRT] *************** Autotuning format combination: Float(16588800,32400,180,1) -> Float(16588800,32400,180,1) ***************
[12/14/2023-21:07:51] [V] [TRT] --------------- Timing Runner: Transpose_0 (Shuffle[0x8000000d])
[12/14/2023-21:07:51] [V] [TRT] Tactic: 0x0000000000000000 Time: 0.206263
[12/14/2023-21:07:51] [V] [TRT] Tactic: 0x0000000000000001 Time: 0.173202
[12/14/2023-21:07:51] [V] [TRT] Transpose_0 (Shuffle[0x8000000d]) profiling completed in 0.0384539 seconds. Fastest Tactic: 0x0000000000000001 Time: 0.173202
[12/14/2023-21:07:51] [V] [TRT] >>>>>>>>>>>>>>> Chose Runner Type: Shuffle Tactic: 0x0000000000000001
[12/14/2023-21:07:51] [V] [TRT] *************** Autotuning format combination: Float(16588800,32400,180,1) -> Float(4147200,1:4,23040,128) ***************
[12/14/2023-21:07:51] [V] [TRT] --------------- Timing Runner: Transpose_0 (Shuffle[0x8000000d])
[12/14/2023-21:07:51] [V] [TRT] Tactic: 0x0000000000000000 Time: 0.658432
[12/14/2023-21:07:51] [V] [TRT] Transpose_0 (Shuffle[0x8000000d]) profiling completed in 0.00619724 seconds. Fastest Tactic: 0x0000000000000000 Time: 0.658432
[12/14/2023-21:07:51] [V] [TRT] >>>>>>>>>>>>>>> Chose Runner Type: Shuffle Tactic: 0x0000000000000000
[12/14/2023-21:07:51] [V] [TRT] *************** Autotuning format combination: Float(16588800,1,92160,512) -> Float(16588800,1,92160,512) ***************
[12/14/2023-21:07:51] [V] [TRT] --------------- Timing Runner: Transpose_0 (Shuffle[0x8000000d])
[12/14/2023-21:07:51] [V] [TRT] Tactic: 0x0000000000000000 Time: 0.806327
[12/14/2023-21:07:51] [V] [TRT] Tactic: 0x0000000000000001 Time: 0.175397
[12/14/2023-21:07:51] [V] [TRT] Transpose_0 (Shuffle[0x8000000d]) profiling completed in 0.0104656 seconds. Fastest Tactic: 0x0000000000000001 Time: 0.175397
[12/14/2023-21:07:51] [V] [TRT] >>>>>>>>>>>>>>> Chose Runner Type: Shuffle Tactic: 0x0000000000000001
[12/14/2023-21:07:51] [V] [TRT] *************** Autotuning format combination: Float(4147200,1:4,23040,128) -> Float(16588800,32400,180,1) ***************
[12/14/2023-21:07:51] [V] [TRT] --------------- Timing Runner: Transpose_0 (Shuffle[0x8000000d])
[12/14/2023-21:07:51] [V] [TRT] Tactic: 0x0000000000000000 Time: 0.798135
[12/14/2023-21:07:51] [V] [TRT] Transpose_0 (Shuffle[0x8000000d]) profiling completed in 0.00733757 seconds. Fastest Tactic: 0x0000000000000000 Time: 0.798135
[12/14/2023-21:07:51] [V] [TRT] >>>>>>>>>>>>>>> Chose Runner Type: Shuffle Tactic: 0x0000000000000000
[12/14/2023-21:07:51] [V] [TRT] *************** Autotuning format combination: Float(4147200,1:4,23040,128) -> Float(4147200,1:4,23040,128) ***************
[12/14/2023-21:07:51] [V] [TRT] --------------- Timing Runner: Transpose_0 (Shuffle[0x8000000d])
[12/14/2023-21:07:51] [V] [TRT] Tactic: 0x0000000000000000 Time: 0.890295
[12/14/2023-21:07:51] [V] [TRT] Tactic: 0x0000000000000001 Time: 0.16619
[12/14/2023-21:07:51] [V] [TRT] Transpose_0 (Shuffle[0x8000000d]) profiling completed in 0.0110617 seconds. Fastest Tactic: 0x0000000000000001 Time: 0.16619
[12/14/2023-21:07:51] [V] [TRT] >>>>>>>>>>>>>>> Chose Runner Type: Shuffle Tactic: 0x0000000000000001
[12/14/2023-21:07:51] [V] [TRT] *************** Autotuning format combination: Float(518400,32400:32,180,1) -> Float(518400,32400:32,180,1) ***************
[12/14/2023-21:07:51] [V] [TRT] --------------- Timing Runner: Transpose_0 (Shuffle[0x8000000d])
[12/14/2023-21:07:51] [V] [TRT] Tactic: 0x0000000000000000 Time: 1.37099
[12/14/2023-21:07:51] [V] [TRT] Tactic: 0x0000000000000001 Time: 0.172763
[12/14/2023-21:07:51] [V] [TRT] Transpose_0 (Shuffle[0x8000000d]) profiling completed in 0.0147639 seconds. Fastest Tactic: 0x0000000000000001 Time: 0.172763
[12/14/2023-21:07:51] [V] [TRT] >>>>>>>>>>>>>>> Chose Runner Type: Shuffle Tactic: 0x0000000000000001
[12/14/2023-21:07:51] [V] [TRT] *************** Autotuning format combination: Half(16588800,32400,180,1) -> Half(16588800,32400,180,1) ***************
[12/14/2023-21:07:51] [V] [TRT] --------------- Timing Runner: Transpose_0 (Shuffle[0x8000000d])
[12/14/2023-21:07:51] [V] [TRT] Tactic: 0x0000000000000000 Time: 0.177445
[12/14/2023-21:07:51] [V] [TRT] Tactic: 0x0000000000000001 Time: 0.401262
[12/14/2023-21:07:51] [V] [TRT] Transpose_0 (Shuffle[0x8000000d]) profiling completed in 0.00757474 seconds. Fastest Tactic: 0x0000000000000000 Time: 0.177445
[12/14/2023-21:07:51] [V] [TRT] >>>>>>>>>>>>>>> Chose Runner Type: Shuffle Tactic: 0x0000000000000000
[12/14/2023-21:07:51] [V] [TRT] *************** Autotuning format combination: Half(16588800,32400,180,1) -> Half(8294400,1:2,46080,256) ***************
[12/14/2023-21:07:51] [V] [TRT] --------------- Timing Runner: Transpose_0 (Shuffle[0x8000000d])
[12/14/2023-21:07:51] [V] [TRT] Tactic: 0x0000000000000000 Time: 0.675456
[12/14/2023-21:07:51] [V] [TRT] Transpose_0 (Shuffle[0x8000000d]) profiling completed in 0.00625231 seconds. Fastest Tactic: 0x0000000000000000 Time: 0.675456
[12/14/2023-21:07:51] [V] [TRT] >>>>>>>>>>>>>>> Chose Runner Type: Shuffle Tactic: 0x0000000000000000
[12/14/2023-21:07:51] [V] [TRT] *************** Autotuning format combination: Half(16588800,32400,180,1) -> Half(2073600,1:8,11520,64) ***************
[12/14/2023-21:07:51] [V] [TRT] --------------- Timing Runner: Transpose_0 (Shuffle[0x8000000d])
[12/14/2023-21:07:51] [V] [TRT] Tactic: 0x0000000000000000 Time: 0.682862
[12/14/2023-21:07:51] [V] [TRT] Transpose_0 (Shuffle[0x8000000d]) profiling completed in 0.00629587 seconds. Fastest Tactic: 0x0000000000000000 Time: 0.682862
[12/14/2023-21:07:51] [V] [TRT] >>>>>>>>>>>>>>> Chose Runner Type: Shuffle Tactic: 0x0000000000000000
[12/14/2023-21:07:51] [V] [TRT] *************** Autotuning format combination: Half(8294400,32400:2,180,1) -> Half(8294400,32400:2,180,1) ***************
[12/14/2023-21:07:51] [V] [TRT] --------------- Timing Runner: Transpose_0 (Shuffle[0x8000000d])
[12/14/2023-21:07:51] [V] [TRT] Tactic: 0x0000000000000000 Time: 0.103863
[12/14/2023-21:07:51] [V] [TRT] Tactic: 0x0000000000000001 Time: 0.506034
[12/14/2023-21:07:51] [V] [TRT] Transpose_0 (Shuffle[0x8000000d]) profiling completed in 0.00904434 seconds. Fastest Tactic: 0x0000000000000000 Time: 0.103863
[12/14/2023-21:07:51] [V] [TRT] >>>>>>>>>>>>>>> Chose Runner Type: Shuffle Tactic: 0x0000000000000000
[12/14/2023-21:07:51] [V] [TRT] *************** Autotuning format combination: Half(8294400,1:2,46080,256) -> Half(16588800,32400,180,1) ***************
[12/14/2023-21:07:51] [V] [TRT] --------------- Timing Runner: Transpose_0 (Shuffle[0x8000000d])
[12/14/2023-21:07:51] [V] [TRT] Tactic: 0x0000000000000000 Time: 0.455735
[12/14/2023-21:07:51] [V] [TRT] Transpose_0 (Shuffle[0x8000000d]) profiling completed in 0.00452053 seconds. Fastest Tactic: 0x0000000000000000 Time: 0.455735
[12/14/2023-21:07:51] [V] [TRT] >>>>>>>>>>>>>>> Chose Runner Type: Shuffle Tactic: 0x0000000000000000
[12/14/2023-21:07:51] [V] [TRT] *************** Autotuning format combination: Half(8294400,1:2,46080,256) -> Half(8294400,1:2,46080,256) ***************
[12/14/2023-21:07:51] [V] [TRT] --------------- Timing Runner: Transpose_0 (Shuffle[0x8000000d])
[12/14/2023-21:07:51] [V] [TRT] Tactic: 0x0000000000000000 Time: 0.415598
[12/14/2023-21:07:51] [V] [TRT] Tactic: 0x0000000000000001 Time: 0.0882834
[12/14/2023-21:07:51] [V] [TRT] Transpose_0 (Shuffle[0x8000000d]) profiling completed in 0.00767282 seconds. Fastest Tactic: 0x0000000000000001 Time: 0.0882834
[12/14/2023-21:07:51] [V] [TRT] >>>>>>>>>>>>>>> Chose Runner Type: Shuffle Tactic: 0x0000000000000001
[12/14/2023-21:07:51] [V] [TRT] *************** Autotuning format combination: Half(4147200,1:4,23040,128) -> Half(4147200,1:4,23040,128) ***************
[12/14/2023-21:07:51] [V] [TRT] --------------- Timing Runner: Transpose_0 (Shuffle[0x8000000d])
[12/14/2023-21:07:51] [V] [TRT] Tactic: 0x0000000000000000 Time: 0.409897
[12/14/2023-21:07:51] [V] [TRT] Tactic: 0x0000000000000001 Time: 0.0863086
[12/14/2023-21:07:51] [V] [TRT] Transpose_0 (Shuffle[0x8000000d]) profiling completed in 0.0072333 seconds. Fastest Tactic: 0x0000000000000001 Time: 0.0863086
[12/14/2023-21:07:51] [V] [TRT] >>>>>>>>>>>>>>> Chose Runner Type: Shuffle Tactic: 0x0000000000000001
[12/14/2023-21:07:51] [V] [TRT] *************** Autotuning format combination: Half(2073600,1:8,11520,64) -> Half(16588800,32400,180,1) ***************
[12/14/2023-21:07:51] [V] [TRT] --------------- Timing Runner: Transpose_0 (Shuffle[0x8000000d])
[12/14/2023-21:07:51] [V] [TRT] Tactic: 0x0000000000000000 Time: 0.456704
[12/14/2023-21:07:51] [V] [TRT] Transpose_0 (Shuffle[0x8000000d]) profiling completed in 0.0045498 seconds. Fastest Tactic: 0x0000000000000000 Time: 0.456704
[12/14/2023-21:07:51] [V] [TRT] >>>>>>>>>>>>>>> Chose Runner Type: Shuffle Tactic: 0x0000000000000000
[12/14/2023-21:07:51] [V] [TRT] *************** Autotuning format combination: Half(2073600,1:8,11520,64) -> Half(2073600,1:8,11520,64) ***************
[12/14/2023-21:07:51] [V] [TRT] --------------- Timing Runner: Transpose_0 (Shuffle[0x8000000d])
[12/14/2023-21:07:51] [V] [TRT] Tactic: 0x0000000000000000 Time: 0.404773
[12/14/2023-21:07:51] [V] [TRT] Tactic: 0x0000000000000001 Time: 0.0850651
[12/14/2023-21:07:51] [V] [TRT] Transpose_0 (Shuffle[0x8000000d]) profiling completed in 0.00713755 seconds. Fastest Tactic: 0x0000000000000001 Time: 0.0850651
[12/14/2023-21:07:51] [V] [TRT] >>>>>>>>>>>>>>> Chose Runner Type: Shuffle Tactic: 0x0000000000000001
[12/14/2023-21:07:51] [V] [TRT] *************** Autotuning format combination: Half(1036800,1:16,5760,32) -> Half(1036800,1:16,5760,32) ***************
[12/14/2023-21:07:51] [V] [TRT] --------------- Timing Runner: Transpose_0 (Shuffle[0x8000000d])
[12/14/2023-21:07:51] [V] [TRT] Tactic: 0x0000000000000000 Time: 0.410094
[12/14/2023-21:07:51] [V] [TRT] Tactic: 0x0000000000000001 Time: 0.0849257
[12/14/2023-21:07:51] [V] [TRT] Transpose_0 (Shuffle[0x8000000d]) profiling completed in 0.0115334 seconds. Fastest Tactic: 0x0000000000000001 Time: 0.0849257
[12/14/2023-21:07:51] [V] [TRT] >>>>>>>>>>>>>>> Chose Runner Type: Shuffle Tactic: 0x0000000000000001
[12/14/2023-21:07:51] [V] [TRT] *************** Autotuning format combination: Half(518400,32400:32,180,1) -> Half(518400,32400:32,180,1) ***************
[12/14/2023-21:07:51] [V] [TRT] --------------- Timing Runner: Transpose_0 (Shuffle[0x8000000d])
[12/14/2023-21:07:51] [V] [TRT] Tactic: 0x0000000000000000 Time: 0.354743
[12/14/2023-21:07:51] [V] [TRT] Tactic: 0x0000000000000001 Time: 0.0945166
[12/14/2023-21:07:51] [V] [TRT] Transpose_0 (Shuffle[0x8000000d]) profiling completed in 0.00757404 seconds. Fastest Tactic: 0x0000000000000001 Time: 0.0945166
[12/14/2023-21:07:51] [V] [TRT] >>>>>>>>>>>>>>> Chose Runner Type: Shuffle Tactic: 0x0000000000000001
[12/14/2023-21:07:51] [V] [TRT] *************** Autotuning format combination: Int8(16588800,32400,180,1) -> Int8(16588800,32400,180,1) ***************
[12/14/2023-21:07:51] [V] [TRT] --------------- Timing Runner: Transpose_0 (Shuffle[0x8000000d])
[12/14/2023-21:07:51] [V] [TRT] Tactic: 0x0000000000000000 Time: 0.197632
[12/14/2023-21:07:51] [V] [TRT] Tactic: 0x0000000000000001 Time: 0.0945737
[12/14/2023-21:07:51] [V] [TRT] Transpose_0 (Shuffle[0x8000000d]) profiling completed in 0.00630358 seconds. Fastest Tactic: 0x0000000000000001 Time: 0.0945737
[12/14/2023-21:07:51] [V] [TRT] >>>>>>>>>>>>>>> Chose Runner Type: Shuffle Tactic: 0x0000000000000001
[12/14/2023-21:07:51] [V] [TRT] *************** Autotuning format combination: Int8(16588800,32400,180,1) -> Int8(1036800,1:16,5760,32) ***************
[12/14/2023-21:07:51] [V] [TRT] --------------- Timing Runner: Transpose_0 (Shuffle[0x8000000d])
[12/14/2023-21:07:51] [V] [TRT] Tactic: 0x0000000000000000 Time: 0.716507
[12/14/2023-21:07:51] [V] [TRT] Transpose_0 (Shuffle[0x8000000d]) profiling completed in 0.00652033 seconds. Fastest Tactic: 0x0000000000000000 Time: 0.716507
[12/14/2023-21:07:51] [V] [TRT] >>>>>>>>>>>>>>> Chose Runner Type: Shuffle Tactic: 0x0000000000000000
[12/14/2023-21:07:51] [V] [TRT] *************** Autotuning format combination: Int8(4147200,32400:4,180,1) -> Int8(4147200,32400:4,180,1) ***************
[12/14/2023-21:07:51] [V] [TRT] --------------- Timing Runner: Transpose_0 (Shuffle[0x8000000d])
[12/14/2023-21:07:51] [V] [TRT] Tactic: 0x0000000000000000 Time: 0.082096
[12/14/2023-21:07:51] [V] [TRT] Tactic: 0x0000000000000001 Time: 0.118267
[12/14/2023-21:07:51] [V] [TRT] Transpose_0 (Shuffle[0x8000000d]) profiling completed in 0.00640972 seconds. Fastest Tactic: 0x0000000000000000 Time: 0.082096
[12/14/2023-21:07:51] [V] [TRT] >>>>>>>>>>>>>>> Chose Runner Type: Shuffle Tactic: 0x0000000000000000
[12/14/2023-21:07:51] [V] [TRT] *************** Autotuning format combination: Int8(1036800,1:16,5760,32) -> Int8(16588800,32400,180,1) ***************
[12/14/2023-21:07:51] [V] [TRT] --------------- Timing Runner: Transpose_0 (Shuffle[0x8000000d])
[12/14/2023-21:07:51] [V] [TRT] Tactic: 0x0000000000000000 Time: 0.368219
[12/14/2023-21:07:51] [V] [TRT] Transpose_0 (Shuffle[0x8000000d]) profiling completed in 0.00379302 seconds. Fastest Tactic: 0x0000000000000000 Time: 0.368219
[12/14/2023-21:07:51] [V] [TRT] >>>>>>>>>>>>>>> Chose Runner Type: Shuffle Tactic: 0x0000000000000000
[12/14/2023-21:07:51] [V] [TRT] *************** Autotuning format combination: Int8(518400,32400:32,180,1) -> Int8(518400,32400:32,180,1) ***************
[12/14/2023-21:07:51] [V] [TRT] --------------- Timing Runner: Transpose_0 (Shuffle[0x8000000d])
[12/14/2023-21:07:51] [V] [TRT] Tactic: 0x0000000000000000 Time: 0.358523
[12/14/2023-21:07:51] [V] [TRT] Tactic: 0x0000000000000001 Time: 0.0686156
[12/14/2023-21:07:51] [V] [TRT] Transpose_0 (Shuffle[0x8000000d]) profiling completed in 0.00743783 seconds. Fastest Tactic: 0x0000000000000001 Time: 0.0686156
[12/14/2023-21:07:51] [V] [TRT] >>>>>>>>>>>>>>> Chose Runner Type: Shuffle Tactic: 0x0000000000000001
[12/14/2023-21:07:51] [V] [TRT] =============== Computing costs for 
[12/14/2023-21:07:51] [V] [TRT] *************** Autotuning format combination: Float(16588800,32400,180,1) -> Float(518400,32400,180,1) ***************
[12/14/2023-21:07:51] [V] [TRT] --------------- Timing Runner: Conv_3 (CaskConvolution[0x80000009])
[12/14/2023-21:07:51] [V] [TRT] Tactic Name: ampere_scudnn_128x128_relu_medium_nn_v1 Tactic: 0xf067e6205da31c2e Time: 0.228059
[12/14/2023-21:07:51] [V] [TRT] Tactic Name: ampere_scudnn_128x128_relu_small_nn_v1 Tactic: 0x503619c69ae500ff Time: 0.226743
[12/14/2023-21:07:51] [V] [TRT] Tactic Name: ampere_scudnn_128x128_relu_interior_nn_v1 Tactic: 0xa8ef60e712f8ad24 Time: 0.22411
[12/14/2023-21:07:51] [V] [TRT] Tactic Name: ampere_scudnn_128x64_relu_small_nn_v1 Tactic: 0x3f243c490d502deb Time: 0.135534
[12/14/2023-21:07:51] [V] [TRT] Tactic Name: sm50_xmma_conv_fprop_fused_conv_act_fp32_NCHW_fp32_NCHW_KCRS_fp32_fp32_fp32_Accfloat_1_1_cC1_dC1_srcVec1_fltVec1_1_TP7_TQ4_C1_R1_S1_U1_V1 Tactic: 0x588a737570bcf22b Time: 0.227035
[12/14/2023-21:07:51] [V] [TRT] Tactic Name: sm80_xmma_fprop_implicit_gemm_indexed_f32f32_f32f32_f32_nchwkcrs_nchw_tilesize128x64x8_stage2_warpsize1x4x1_g1_ffma_aligna4_alignc4_beta0_packed_stride Tactic: 0xede36641840ce3d2 Time: 0.150235
[12/14/2023-21:07:51] [V] [TRT] Tactic Name: sm50_xmma_conv_fprop_fused_conv_act_fp32_NCHW_fp32_NCHW_KCRS_fp32_fp32_fp32_Accfloat_1_1_cC1_dC1_srcVec4_fltVec1_1_TP4_TQ8_C1_R1_S1_U1_V1 Tactic: 0xd646964a96ca001d Time: 0.126171
[12/14/2023-21:07:51] [V] [TRT] Tactic Name: sm50_xmma_conv_fprop_fused_conv_act_fp32_NCHW_fp32_NCHW_KCRS_fp32_fp32_fp32_Accfloat_1_1_cC1_dC1_srcVec2_fltVec2_2_TP7_TQ2_C4_R1_S1_U1_V1 Tactic: 0xc0bfd75233df14d7 Time: 0.422034
[12/14/2023-21:07:51] [V] [TRT] Tactic Name: sm50_xmma_conv_fprop_fused_conv_act_fp32_NCHW_fp32_NCHW_KCRS_fp32_fp32_fp32_Accfloat_1_1_cC1_dC1_srcVec1_fltVec4_4_TP4_TQ5_C8_R1_S1_U1_V1 Tactic: 0x80a5d7e9c9c4b8ce Time: 0.433298
[12/14/2023-21:07:51] [V] [TRT] Tactic Name: sm80_xmma_fprop_implicit_gemm_indexed_f32f32_f32f32_f32_nchwkcrs_nchw_tilesize128x32x8_stage3_warpsize2x2x1_g1_ffma_aligna4_alignc4 Tactic: 0xa9366041633a5135 Time: 0.141525
[12/14/2023-21:07:51] [V] [TRT] Tactic Name: sm80_xmma_fprop_implicit_gemm_indexed_f32f32_f32f32_f32_nchwkcrs_nchw_tilesize128x64x8_stage2_warpsize4x1x1_g1_ffma_aligna4_alignc4_beta0_packed_stride Tactic: 0x1673e3594ce11cea Time: 0.167351
[12/14/2023-21:07:51] [V] [TRT] Tactic Name: sm50_xmma_conv_fprop_fused_conv_act_fp32_NCHW_fp32_NCHW_KCRS_fp32_fp32_fp32_Accfloat_1_1_cC1_dC1_srcVec4_fltVec1_1_TP7_TQ2_C2_R1_S1_U1_V1 Tactic: 0x001526e231ae2e51 Time: 0.581632
[12/14/2023-21:07:51] [V] [TRT] Tactic Name: sm80_xmma_fprop_implicit_gemm_f32f32_f32f32_f32_nchwkcrs_nchw_tilesize64x256x8_stage3_warpsize1x4x1_g1_ffma_t1r1s1_aligna4_alignc4 Tactic: 0x2ee10e11d6651675 Time: 0.500882
[12/14/2023-21:07:51] [V] [TRT] Fast skip Tactic:0x46094dd94e60f58a which exceed time limit during pre-run
[12/14/2023-21:07:51] [V] [TRT] Tactic Name: sm50_xmma_conv_fprop_fused_conv_act_fp32_NCHW_fp32_NCHW_KCRS_fp32_fp32_fp32_Accfloat_1_1_cC1_dC1_srcVec4_fltVec1_1_TP7_TQ1_C1_R1_S1_U1_V1 Tactic: 0x46094dd94e60f58a Time: 4.58403
[12/14/2023-21:07:51] [V] [TRT] Tactic Name: sm50_xmma_conv_fprop_fused_conv_act_fp32_NCHW_fp32_NCHW_KCRS_fp32_fp32_fp32_Accfloat_1_1_cC1_dC1_srcVec2_fltVec2_2_TP7_TQ4_C4_R1_S1_U1_V1 Tactic: 0x361add5e7e5ba900 Time: 0.165157
[12/14/2023-21:07:51] [V] [TRT] Tactic Name: sm50_xmma_conv_fprop_fused_conv_act_fp32_NCHW_fp32_NCHW_KCRS_fp32_fp32_fp32_Accfloat_1_1_cC1_dC1_srcVec4_fltVec1_1_TP5_TQ5_C2_R1_S1_U1_V1 Tactic: 0x55214d4ab35e0b9d Time: 0.123392
[12/14/2023-21:07:51] [V] [TRT] Tactic Name: sm50_xmma_conv_fprop_fused_conv_act_fp32_NCHW_fp32_NCHW_KCRS_fp32_fp32_fp32_Accfloat_1_1_cC1_dC1_srcVec4_fltVec1_1_TP4_TQ7_C4_R1_S1_U1_V1 Tactic: 0x95559a386f1ab48c Time: 0.116649
[12/14/2023-21:07:51] [V] [TRT] Tactic Name: sm50_xmma_conv_fprop_fused_conv_act_fp32_NCHW_fp32_NCHW_KCRS_fp32_fp32_fp32_Accfloat_1_1_cC1_dC1_srcVec2_fltVec2_2_TP3_TQ10_C8_R1_S1_U1_V1 Tactic: 0x06122dede8a04ac8 Time: 0.18213
[12/14/2023-21:07:51] [V] [TRT] Tactic Name: sm80_xmma_fprop_implicit_gemm_indexed_f32f32_f32f32_f32_nchwkcrs_nchw_tilesize32x32x8_stage3_warpsize1x2x1_g1_ffma_aligna4_alignc4 Tactic: 0xcb8a43f748d8a338 Time: 0.115785
[12/14/2023-21:07:51] [V] [TRT] Tactic Name: sm50_xmma_conv_fprop_fused_conv_act_fp32_NCHW_fp32_NCHW_KCRS_fp32_fp32_fp32_Accfloat_1_1_cC1_dC1_srcVec4_fltVec1_1_TP2_TQ7_C1_R1_S1_U1_V1 Tactic: 0xdfbf20bf5c5ed39e Time: 0.15989
[12/14/2023-21:07:51] [V] [TRT] Tactic Name: sm50_xmma_conv_fprop_fused_conv_act_fp32_NCHW_fp32_NCHW_KCRS_fp32_fp32_fp32_Accfloat_1_1_cC1_dC1_srcVec4_fltVec1_1_TP7_TQ4_C4_R1_S1_U1_V1 Tactic: 0x8c2df094ce3399e7 Time: 0.122295
[12/14/2023-21:07:51] [V] [TRT] Tactic Name: sm50_xmma_conv_fprop_fused_conv_act_fp32_NCHW_fp32_NCHW_KCRS_fp32_fp32_fp32_Accfloat_1_1_cC1_dC1_srcVec2_fltVec2_2_TP3_TQ9_C8_R1_S1_U1_V1 Tactic: 0xdb776069eecca7f3 Time: 0.1872
[12/14/2023-21:07:51] [V] [TRT] Tactic Name: sm80_xmma_fprop_implicit_gemm_f32f32_f32f32_f32_nchwkcrs_nchw_tilesize64x128x8_stage3_warpsize1x4x1_g1_ffma_aligna4_alignc4 Tactic: 0x5aa723e0481da855 Time: 0.20875
[12/14/2023-21:07:51] [V] [TRT] Tactic Name: sm50_xmma_conv_fprop_fused_conv_act_fp32_NCHW_fp32_NCHW_KCRS_fp32_fp32_fp32_Accfloat_1_1_cC1_dC1_srcVec2_fltVec2_2_TP2_TQ8_C2_R1_S1_U1_V1 Tactic: 0x5c06dd7da7ff5d89 Time: 0.15989
[12/14/2023-21:07:51] [V] [TRT] Tactic Name: sm50_xmma_conv_fprop_fused_conv_act_fp32_NCHW_fp32_NCHW_KCRS_fp32_fp32_fp32_Accfloat_1_1_cC1_dC1_srcVec2_fltVec2_2_TP4_TQ4_C2_R1_S1_U1_V1 Tactic: 0xe7c1b91b9c2edfa3 Time: 0.163694
[12/14/2023-21:07:51] [V] [TRT] Tactic Name: sm50_xmma_conv_fprop_fused_conv_act_fp32_NCHW_fp32_NCHW_KCRS_fp32_fp32_fp32_Accfloat_1_1_cC1_dC1_srcVec2_fltVec1_1_TP3_TQ10_C1_R1_S1_U1_V1 Tactic: 0x053bede31607189f Time: 0.150089
[12/14/2023-21:07:51] [V] [TRT] Tactic Name: sm80_xmma_fprop_implicit_gemm_f32f32_f32f32_f32_nchwkcrs_nchw_tilesize64x64x8_stage3_warpsize1x4x1_g1_ffma_t1r1s1_aligna4_alignc4 Tactic: 0x865894c4635db7fd Time: 0.128439
[12/14/2023-21:07:51] [V] [TRT] Tactic Name: sm50_xmma_conv_fprop_fused_conv_act_fp32_NCHW_fp32_NCHW_KCRS_fp32_fp32_fp32_Accfloat_1_1_cC1_dC1_srcVec2_fltVec2_2_TP4_TQ7_C4_R1_S1_U1_V1 Tactic: 0x2f62b7f2df72846b Time: 0.154665
[12/14/2023-21:07:51] [V] [TRT] Tactic Name: sm50_xmma_conv_fprop_fused_conv_act_fp32_NCHW_fp32_NCHW_KCRS_fp32_fp32_fp32_Accfloat_1_1_cC1_dC1_srcVec4_fltVec1_1_TP4_TQ8_C8_R1_S1_U1_V1 Tactic: 0xadc24b6dce6a94cc Time: 0.125758
[12/14/2023-21:07:51] [V] [TRT] Tactic Name: sm50_xmma_conv_fprop_fused_conv_act_fp32_NCHW_fp32_NCHW_KCRS_fp32_fp32_fp32_Accfloat_1_1_cC1_dC1_srcVec1_fltVec4_4_TP2_TQ7_C4_R1_S1_U1_V1 Tactic: 0xe3a8b64d995c2040 Time: 0.396142
[12/14/2023-21:07:51] [V] [TRT] Tactic Name: sm80_xmma_fprop_implicit_gemm_indexed_f32f32_f32f32_f32_nchwkcrs_nchw_tilesize128x16x8_stage3_warpsize4x1x1_g1_ffma_aligna4_alignc4 Tactic: 0x40a12e3938221818 Time: 0.108837
[12/14/2023-21:07:51] [V] [TRT] Tactic Name: sm50_xmma_conv_fprop_fused_conv_act_fp32_NCHW_fp32_NCHW_KCRS_fp32_fp32_fp32_Accfloat_1_1_cC1_dC1_srcVec2_fltVec2_2_TP2_TQ9_C4_R1_S1_U1_V1 Tactic: 0xc6c6d590dfdf6d0c Time: 0.168667
[12/14/2023-21:07:51] [V] [TRT] Tactic Name: sm50_xmma_conv_fprop_fused_conv_act_fp32_NCHW_fp32_NCHW_KCRS_fp32_fp32_fp32_Accfloat_1_1_cC1_dC1_srcVec1_fltVec4_4_TP6_TQ5_C4_R1_S1_U1_V1 Tactic: 0x3652da2fa8bb0ef3 Time: 0.402181
[12/14/2023-21:07:51] [V] [TRT] Tactic Name: sm50_xmma_conv_fprop_fused_conv_act_fp32_NCHW_fp32_NCHW_KCRS_fp32_fp32_fp32_Accfloat_1_1_cC1_dC1_srcVec2_fltVec2_2_TP8_TQ2_C8_R1_S1_U1_V1 Tactic: 0x84b1c619b722ac50 Time: 0.367909
[12/14/2023-21:07:51] [V] [TRT] Tactic Name: sm50_xmma_conv_fprop_fused_conv_act_fp32_NCHW_fp32_NCHW_KCRS_fp32_fp32_fp32_Accfloat_1_1_cC1_dC1_srcVec1_fltVec4_4_TP4_TQ7_C4_R1_S1_U1_V1 Tactic: 0x27fd6918968ac741 Time: 0.41077
[12/14/2023-21:07:51] [V] [TRT] Tactic Name: sm80_xmma_fprop_implicit_gemm_f32f32_f32f32_f32_nchwkcrs_nchw_tilesize256x128x8_stage3_warpsize4x2x1_g1_ffma_simple_t1r1s1_aligna4_alignc4 Tactic: 0xfff46c7893896eb1 Time: 0.209774
[12/14/2023-21:07:51] [V] [TRT] Tactic Name: sm50_xmma_conv_fprop_fused_conv_act_fp32_NCHW_fp32_NCHW_KCRS_fp32_fp32_fp32_Accfloat_1_1_cC1_dC1_srcVec4_fltVec1_1_TP1_TQ7_C1_R1_S1_U1_V1 Tactic: 0x74f998800c32af5c Time: 0.373088
[12/14/2023-21:07:51] [V] [TRT] Tactic Name: sm50_xmma_conv_fprop_fused_conv_act_fp32_NCHW_fp32_NCHW_KCRS_fp32_fp32_fp32_Accfloat_1_1_cC1_dC1_srcVec1_fltVec4_4_TP3_TQ7_C4_R1_S1_U1_V1 Tactic: 0x0b22bb41cc7dfe7d Time: 0.293157
[12/14/2023-21:07:51] [V] [TRT] Tactic Name: sm80_xmma_fprop_implicit_gemm_f32f32_f32f32_f32_nchwkcrs_nchw_tilesize32x32x8_stage3_warpsize1x2x1_g1_ffma_aligna4_alignc4 Tactic: 0xb0bf940d5e0f9f45 Time: 0.0963383
[12/14/2023-21:07:51] [V] [TRT] Tactic Name: sm50_xmma_conv_fprop_fused_conv_act_fp32_NCHW_fp32_NCHW_KCRS_fp32_fp32_fp32_Accfloat_1_1_cC1_dC1_srcVec2_fltVec2_2_TP4_TQ4_C8_R1_S1_U1_V1 Tactic: 0x6867dd944a05c100 Time: 0.196901
[12/14/2023-21:07:51] [V] [TRT] Tactic Name: sm80_xmma_fprop_implicit_gemm_indexed_f32f32_f32f32_f32_nchwkcrs_nchw_tilesize64x64x8_stage3_warpsize1x4x1_g1_ffma_aligna4_alignc4 Tactic: 0xd828f024626fa982 Time: 0.150528
[12/14/2023-21:07:51] [V] [TRT] Tactic Name: sm80_xmma_fprop_implicit_gemm_indexed_f32f32_f32f32_f32_nchwkcrs_nchw_tilesize128x64x8_stage2_warpsize2x2x1_g1_ffma_aligna4_alignc4_beta0_packed_stride Tactic: 0x31aa67f57c5aea77 Time: 0.15856
[12/14/2023-21:07:51] [V] [TRT] Tactic Name: sm80_xmma_fprop_implicit_gemm_f32f32_f32f32_f32_nchwkcrs_nchw_tilesize64x128x8_stage3_warpsize1x4x1_g1_ffma_simple_t1r1s1_aligna4_alignc4 Tactic: 0x9cd5cdc35441c505 Time: 0.215771
[12/14/2023-21:07:51] [V] [TRT] Tactic Name: sm80_xmma_fprop_implicit_gemm_f32f32_f32f32_f32_nchwkcrs_nchw_tilesize128x32x8_stage3_warpsize2x2x1_g1_ffma_simple_t1r1s1_aligna4_alignc4 Tactic: 0x828d0ea88c66fce7 Time: 0.118857
[12/14/2023-21:07:51] [V] [TRT] Tactic Name: sm50_xmma_conv_fprop_fused_conv_act_fp32_NCHW_fp32_NCHW_KCRS_fp32_fp32_fp32_Accfloat_1_1_cC1_dC1_srcVec4_fltVec1_1_TP4_TQ7_C8_R1_S1_U1_V1 Tactic: 0x606e22cd0b28a04e Time: 0.1152
[12/14/2023-21:07:51] [V] [TRT] Tactic Name: sm80_xmma_fprop_implicit_gemm_f32f32_f32f32_f32_nchwkcrs_nchw_tilesize64x64x8_stage3_warpsize1x4x1_g1_ffma_simple_t1r1s1_aligna4_alignc4 Tactic: 0x1fc87d7eb370bb7a Time: 0.128128
[12/14/2023-21:07:51] [V] [TRT] Tactic Name: sm50_xmma_conv_fprop_fused_conv_act_fp32_NCHW_fp32_NCHW_KCRS_fp32_fp32_fp32_Accfloat_1_1_cC1_dC1_srcVec4_fltVec1_1_TP1_TQ8_C2_R1_S1_U1_V1 Tactic: 0x4d77488847fb11ac Time: 0.175982
[12/14/2023-21:07:51] [V] [TRT] Tactic Name: sm80_xmma_fprop_implicit_gemm_f32f32_f32f32_f32_nchwkcrs_nchw_tilesize64x128x8_stage3_warpsize1x4x1_g1_ffma_t1r1s1_aligna4_alignc4 Tactic: 0xc0b05b61d128e46e Time: 0.215177
[12/14/2023-21:07:51] [V] [TRT] Tactic Name: sm80_xmma_fprop_implicit_gemm_f32f32_f32f32_f32_nchwkcrs_nchw_tilesize128x64x8_stage3_warpsize2x2x1_g1_ffma_t1r1s1_aligna4_alignc4 Tactic: 0xe5603263b7f00303 Time: 0.132754
[12/14/2023-21:07:51] [V] [TRT] Tactic Name: sm80_xmma_fprop_implicit_gemm_f32f32_tf32f32_f32_nchwkrsc_nchw_tilesize128x128x16_stage4_warpsize2x2x1_g1_tensor16x8x8_simple_t1r1s1_aligna4_alignc4 Tactic: 0xa419b3b68f2da07b Time: 0.176247
[12/14/2023-21:07:51] [V] [TRT] Tactic Name: sm50_xmma_conv_fprop_fused_conv_act_fp32_NCHW_fp32_NCHW_KCRS_fp32_fp32_fp32_Accfloat_1_1_cC1_dC1_srcVec2_fltVec2_2_TP5_TQ5_C1_R1_S1_U1_V1 Tactic: 0x1b34d9288dbdb108 Time: 0.303397
[12/14/2023-21:07:51] [V] [TRT] Tactic Name: sm80_xmma_fprop_implicit_gemm_f32f32_f32f32_f32_nchwkcrs_nchw_tilesize128x16x8_stage3_warpsize4x1x1_g1_ffma_aligna4_alignc4 Tactic: 0x9d9fdb5fd9945f64 Time: 0.100059
[12/14/2023-21:07:51] [V] [TRT] Tactic Name: sm50_xmma_conv_fprop_fused_conv_act_fp32_NCHW_fp32_NCHW_KCRS_fp32_fp32_fp32_Accfloat_1_1_cC1_dC1_srcVec2_fltVec2_2_TP7_TQ4_C8_R1_S1_U1_V1 Tactic: 0xc32165ab1a69bdc2 Time: 0.208421
[12/14/2023-21:07:51] [V] [TRT] Tactic Name: sm50_xmma_conv_fprop_fused_conv_act_fp32_NCHW_fp32_NCHW_KCRS_fp32_fp32_fp32_Accfloat_1_1_cC1_dC1_srcVec1_fltVec4_4_TP1_TQ10_C2_R1_S1_U1_V1 Tactic: 0x9140485476980e7c Time: 0.322414
[12/14/2023-21:07:51] [V] [TRT] Tactic Name: sm50_xmma_conv_fprop_fused_conv_act_fp32_NCHW_fp32_NCHW_KCRS_fp32_fp32_fp32_Accfloat_1_1_cC1_dC1_srcVec1_fltVec4_4_TP6_TQ5_C2_R1_S1_U1_V1 Tactic: 0x4ccf06551aa20492 Time: 0.442222
[12/14/2023-21:07:51] [V] [TRT] Tactic Name: sm80_xmma_fprop_implicit_gemm_f32f32_tf32f32_f32_nchwkrsc_nchw_tilesize128x64x16_stage2_warpsize2x2x1_g1_tensor16x8x8_simple_t1r1s1_aligna4_alignc4 Tactic: 0xe52b0ddb126aa135 Time: 0.100133
[12/14/2023-21:07:51] [V] [TRT] Tactic Name: sm50_xmma_conv_fprop_fused_conv_act_fp32_NCHW_fp32_NCHW_KCRS_fp32_fp32_fp32_Accfloat_1_1_cC1_dC1_srcVec2_fltVec1_1_TP3_TQ10_C2_R1_S1_U1_V1 Tactic: 0xf119544b988c92ed Time: 0.1152
[12/14/2023-21:07:51] [V] [TRT] Tactic Name: sm50_xmma_conv_fprop_fused_conv_act_fp32_NCHW_fp32_NCHW_KCRS_fp32_fp32_fp32_Accfloat_1_1_cC1_dC1_srcVec2_fltVec2_2_TP2_TQ10_C1_R1_S1_U1_V1 Tactic: 0xc48d91bc4c36e826 Time: 0.259218
[12/14/2023-21:07:51] [V] [TRT] Tactic Name: sm80_xmma_fprop_implicit_gemm_f32f32_f32f32_f32_nchwkcrs_nchw_tilesize64x256x8_stage3_warpsize1x4x1_g1_ffma_simple_t1r1s1_aligna4_alignc4 Tactic: 0x9de226a0c44627c4 Time: 0.45568
[12/14/2023-21:07:51] [V] [TRT] Tactic Name: sm80_xmma_fprop_implicit_gemm_f32f32_tf32f32_f32_nchwkrsc_nchw_tilesize128x128x16_stage4_warpsize2x2x1_g1_tensor16x8x8_t1r1s1_aligna4_alignc4 Tactic: 0x7f0145cb49517338 Time: 0.177152
[12/14/2023-21:07:51] [V] [TRT] Tactic Name: sm50_xmma_conv_fprop_fused_conv_act_fp32_NCHW_fp32_NCHW_KCRS_fp32_fp32_fp32_Accfloat_1_1_cC1_dC1_srcVec2_fltVec1_1_TP3_TQ10_C4_R1_S1_U1_V1 Tactic: 0x8b8488312a95988c Time: 0.113006
[12/14/2023-21:07:51] [V] [TRT] Tactic Name: sm50_xmma_conv_fprop_fused_conv_act_fp32_NCHW_fp32_NCHW_KCRS_fp32_fp32_fp32_Accfloat_1_1_cC1_dC1_srcVec4_fltVec1_1_TP3_TQ9_C4_R1_S1_U1_V1 Tactic: 0x947bf5563a9683d6 Time: 0.109275
[12/14/2023-21:07:51] [V] [TRT] Tactic Name: sm80_xmma_fprop_implicit_gemm_f32f32_f32f32_f32_nchwkcrs_nchw_tilesize128x64x8_stage3_warpsize2x2x1_g1_ffma_simple_t1r1s1_aligna4_alignc4 Tactic: 0x8e3884f0eaec3ecd Time: 0.137947
[12/14/2023-21:07:51] [V] [TRT] Tactic Name: sm50_xmma_conv_fprop_fused_conv_act_fp32_NCHW_fp32_NCHW_KCRS_fp32_fp32_fp32_Accfloat_1_1_cC1_dC1_srcVec4_fltVec1_1_TP8_TQ2_C2_R1_S1_U1_V1 Tactic: 0xb1208f5cd1618214 Time: 0.215186
[12/14/2023-21:07:51] [V] [TRT] Tactic Name: sm50_xmma_conv_fprop_fused_conv_act_fp32_NCHW_fp32_NCHW_KCRS_fp32_fp32_fp32_Accfloat_1_1_cC1_dC1_srcVec2_fltVec2_2_TP2_TQ7_C2_R1_S1_U1_V1 Tactic: 0x91aab4dd62bd690b Time: 0.163694
[12/14/2023-21:07:51] [V] [TRT] Tactic Name: sm50_xmma_conv_fprop_fused_conv_act_fp32_NCHW_fp32_NCHW_KCRS_fp32_fp32_fp32_Accfloat_1_1_cC1_dC1_srcVec4_fltVec1_1_TP4_TQ5_C2_R1_S1_U1_V1 Tactic: 0xbdab4046e67fd5a0 Time: 0.12427
[12/14/2023-21:07:51] [V] [TRT] Tactic Name: ampere_scudnn_128x32_relu_small_nn_v1 Tactic: 0xa8609adc4e0ceb90 Time: 0.10635
[12/14/2023-21:07:51] [V] [TRT] Tactic Name: sm80_xmma_fprop_implicit_gemm_f32f32_f32f32_f32_nchwkcrs_nchw_tilesize32x32x8_stage3_warpsize1x2x1_g1_ffma_simple_t1r1s1_aligna4_alignc4 Tactic: 0x90f8f2915f87ed77 Time: 0.0971337
[12/14/2023-21:07:51] [V] [TRT] Tactic Name: sm50_xmma_conv_fprop_fused_conv_act_fp32_NCHW_fp32_NCHW_KCRS_fp32_fp32_fp32_Accfloat_1_1_cC1_dC1_srcVec4_fltVec1_1_TP4_TQ4_C2_R1_S1_U1_V1 Tactic: 0x5df694d12c46ef44 Time: 0.127561
[12/14/2023-21:07:51] [V] [TRT] Tactic Name: sm50_xmma_conv_fprop_fused_conv_act_fp32_NCHW_fp32_NCHW_KCRS_fp32_fp32_fp32_Accfloat_1_1_cC1_dC1_srcVec2_fltVec2_2_TP2_TQ9_C1_R1_S1_U1_V1 Tactic: 0x4879b042e34ded1f Time: 0.250112
[12/14/2023-21:07:51] [V] [TRT] Tactic Name: sm50_xmma_conv_fprop_fused_conv_act_fp32_NCHW_fp32_NCHW_KCRS_fp32_fp32_fp32_Accfloat_1_1_cC1_dC1_srcVec4_fltVec1_1_TP5_TQ5_C4_R1_S1_U1_V1 Tactic: 0x2fbc9130014701fc Time: 0.127049
[12/14/2023-21:07:51] [V] [TRT] Tactic Name: sm50_xmma_conv_fprop_fused_conv_act_fp32_NCHW_fp32_NCHW_KCRS_fp32_fp32_fp32_Accfloat_1_1_cC1_dC1_srcVec2_fltVec2_2_TP4_TQ4_C1_R1_S1_U1_V1 Tactic: 0x13e300b312a555d1 Time: 0.252178
[12/14/2023-21:07:51] [V] [TRT] Tactic Name: sm50_xmma_conv_fprop_fused_conv_act_fp32_NCHW_fp32_NCHW_KCRS_fp32_fp32_fp32_Accfloat_1_1_cC1_dC1_srcVec4_fltVec1_1_TP2_TQ7_C2_R1_S1_U1_V1 Tactic: 0x2b9d9917d2d559ec Time: 0.130487
[12/14/2023-21:07:51] [V] [TRT] Tactic Name: sm50_xmma_conv_fprop_fused_conv_act_fp32_NCHW_fp32_NCHW_KCRS_fp32_fp32_fp32_Accfloat_1_1_cC1_dC1_srcVec2_fltVec2_2_TP3_TQ8_C1_R1_S1_U1_V1 Tactic: 0x40ae69d97c5509c6 Time: 0.325829
[12/14/2023-21:07:51] [V] [TRT] Tactic Name: ampere_scudnn_128x64_relu_medium_nn_v1 Tactic: 0xf64396b97c889179 Time: 0.139223
[12/14/2023-21:07:51] [V] [TRT] Tactic Name: sm50_xmma_conv_fprop_fused_conv_act_fp32_NCHW_fp32_NCHW_KCRS_fp32_fp32_fp32_Accfloat_1_1_cC1_dC1_srcVec1_fltVec4_4_TP3_TQ8_C2_R1_S1_U1_V1 Tactic: 0xbc130e9bbb26c09e Time: 0.458459
[12/14/2023-21:07:51] [V] [TRT] Tactic Name: sm50_xmma_conv_fprop_fused_conv_act_fp32_NCHW_fp32_NCHW_KCRS_fp32_fp32_fp32_Accfloat_1_1_cC1_dC1_srcVec2_fltVec2_2_TP2_TQ8_C8_R1_S1_U1_V1 Tactic: 0xd3a0b9f271d4432a Time: 0.18624
[12/14/2023-21:07:51] [V] [TRT] Tactic Name: sm50_xmma_conv_fprop_fused_conv_act_fp32_NCHW_fp32_NCHW_KCRS_fp32_fp32_fp32_Accfloat_1_1_cC1_dC1_srcVec4_fltVec1_1_TP2_TQ7_C4_R1_S1_U1_V1 Tactic: 0x5100456d60cc538d Time: 0.15989
[12/14/2023-21:07:51] [V] [TRT] Tactic Name: sm80_xmma_fprop_implicit_gemm_f32f32_tf32f32_f32_nchwkrsc_nchw_tilesize128x32x16_stage2_warpsize2x2x1_g1_tensor16x8x8_simple_t1r1s1_aligna4_alignc4 Tactic: 0xb2c8ebee321e63d6 Time: 0.105993
[12/14/2023-21:07:51] [V] [TRT] Tactic Name: sm50_xmma_conv_fprop_fused_conv_act_fp32_NCHW_fp32_NCHW_KCRS_fp32_fp32_fp32_Accfloat_1_1_cC1_dC1_srcVec2_fltVec2_2_TP1_TQ7_C1_R1_S1_U1_V1 Tactic: 0xceceb54abc5a9fbb Time: 0.552713
[12/14/2023-21:07:51] [V] [TRT] Tactic Name: sm80_xmma_fprop_implicit_gemm_f32f32_f32f32_f32_nchwkcrs_nchw_tilesize128x64x8_stage3_warpsize2x2x1_g1_ffma_aligna4_alignc4 Tactic: 0x12dbf7d94ee3696d Time: 0.133266
[12/14/2023-21:07:51] [V] [TRT] Tactic Name: ampere_scudnn_128x64_relu_interior_nn_v1 Tactic: 0xc3cf6e1d1c6aff27 Time: 0.125586
[12/14/2023-21:07:51] [V] [TRT] Tactic Name: sm50_xmma_conv_fprop_fused_conv_act_fp32_NCHW_fp32_NCHW_KCRS_fp32_fp32_fp32_Accfloat_1_1_cC1_dC1_srcVec4_fltVec1_1_TP2_TQ8_C2_R1_S1_U1_V1 Tactic: 0xe631f0b717976d6e Time: 0.118491
[12/14/2023-21:07:51] [V] [TRT] Tactic Name: sm50_xmma_conv_fprop_fused_conv_act_fp32_NCHW_fp32_NCHW_KCRS_fp32_fp32_fp32_Accfloat_1_1_cC1_dC1_srcVec2_fltVec2_2_TP4_TQ7_C8_R1_S1_U1_V1 Tactic: 0xda590f07bb4090a9 Time: 0.187685
[12/14/2023-21:07:51] [V] [TRT] Tactic Name: sm50_xmma_conv_fprop_fused_conv_act_fp32_NCHW_fp32_NCHW_KCRS_fp32_fp32_fp32_Accfloat_1_1_cC1_dC1_srcVec2_fltVec2_2_TP2_TQ7_C1_R1_S1_U1_V1 Tactic: 0x65880d75ec36e379 Time: 0.241664
[12/14/2023-21:07:51] [V] [TRT] Tactic Name: sm50_xmma_conv_fprop_fused_conv_act_fp32_NCHW_fp32_NCHW_KCRS_fp32_fp32_fp32_Accfloat_1_1_cC1_dC1_srcVec2_fltVec2_2_TP7_TQ2_C2_R1_S1_U1_V1 Tactic: 0xba220b2881c61eb6 Time: 0.247264
[12/14/2023-21:07:51] [V] [TRT] Tactic Name: sm50_xmma_conv_fprop_fused_conv_act_fp32_NCHW_fp32_NCHW_KCRS_fp32_fp32_fp32_Accfloat_1_1_cC1_dC1_srcVec2_fltVec1_1_TP4_TQ8_C8_R1_S1_U1_V1 Tactic: 0x4f9a95a9a8862c25 Time: 0.123685
[12/14/2023-21:07:51] [V] [TRT] Tactic Name: sm50_xmma_conv_fprop_fused_conv_act_fp32_NCHW_fp32_NCHW_KCRS_fp32_fp32_fp32_Accfloat_1_1_cC1_dC1_srcVec2_fltVec2_2_TP2_TQ7_C4_R1_S1_U1_V1 Tactic: 0xeb3768a7d0a4636a Time: 0.173349
[12/14/2023-21:07:51] [V] [TRT] Tactic Name: sm50_xmma_conv_fprop_fused_conv_act_fp32_NCHW_fp32_NCHW_KCRS_fp32_fp32_fp32_Accfloat_1_1_cC1_dC1_srcVec2_fltVec2_2_TP3_TQ10_C2_R1_S1_U1_V1 Tactic: 0x89b449623e8b546b Time: 0.178615
[12/14/2023-21:07:51] [V] [TRT] Tactic Name: sm50_xmma_conv_fprop_fused_conv_act_fp32_NCHW_fp32_NCHW_KCRS_fp32_fp32_fp32_Accfloat_1_1_cC1_dC1_srcVec1_fltVec1_1_TP3_TQ10_C8_R1_S1_U1_V1 Tactic: 0x77ff66671dd929ae Time: 0.142121
[12/14/2023-21:07:51] [V] [TRT] Tactic Name: sm50_xmma_conv_fprop_fused_conv_act_fp32_NCHW_fp32_NCHW_KCRS_fp32_fp32_fp32_Accfloat_1_1_cC1_dC1_srcVec4_fltVec1_1_TP7_TQ4_C8_R1_S1_U1_V1 Tactic: 0x79164861aa018d25 Time: 0.132587
[12/14/2023-21:07:51] [V] [TRT] Tactic Name: sm50_xmma_conv_fprop_fused_conv_act_fp32_NCHW_fp32_NCHW_KCRS_fp32_fp32_fp32_Accfloat_1_1_cC1_dC1_srcVec2_fltVec2_2_TP2_TQ8_C4_R1_S1_U1_V1 Tactic: 0x269b010715e657e8 Time: 0.171008
[12/14/2023-21:07:51] [V] [TRT] Tactic Name: sm50_xmma_conv_fprop_fused_conv_act_fp32_NCHW_fp32_NCHW_KCRS_fp32_fp32_fp32_Accfloat_1_1_cC1_dC1_srcVec1_fltVec4_4_TP3_TQ10_C4_R1_S1_U1_V1 Tactic: 0x0b33f9e893e376e6 Time: 0.386194
[12/14/2023-21:07:51] [V] [TRT] Tactic Name: sm50_xmma_conv_fprop_fused_conv_act_fp32_NCHW_fp32_NCHW_KCRS_fp32_fp32_fp32_Accfloat_1_1_cC1_dC1_srcVec2_fltVec2_2_TP2_TQ9_C2_R1_S1_U1_V1 Tactic: 0xbc5b09ea6dc6676d Time: 0.163255
[12/14/2023-21:07:51] [V] [TRT] Tactic Name: sm80_xmma_fprop_implicit_gemm_f32f32_f32f32_f32_nchwkcrs_nchw_tilesize64x64x8_stage3_warpsize1x4x1_g1_ffma_aligna4_alignc4 Tactic: 0xa31d27de74b895ff Time: 0.128112
[12/14/2023-21:07:51] [V] [TRT] Tactic Name: sm50_xmma_conv_fprop_fused_conv_act_fp32_NCHW_fp32_NCHW_KCRS_fp32_fp32_fp32_Accfloat_1_1_cC1_dC1_srcVec1_fltVec4_4_TP3_TQ7_C8_R1_S1_U1_V1 Tactic: 0xfe1903b4a84feabf Time: 0.412233
[12/14/2023-21:07:51] [V] [TRT] Tactic Name: sm50_xmma_conv_fprop_fused_conv_act_fp32_NCHW_fp32_NCHW_KCRS_fp32_fp32_fp32_Accfloat_1_1_cC1_dC1_srcVec1_fltVec4_4_TP5_TQ5_C1_R1_S1_U1_V1 Tactic: 0x13ab07c2c445f222 Time: 0.539502
[12/14/2023-21:07:51] [V] [TRT] Tactic Name: sm50_xmma_conv_fprop_fused_conv_act_fp32_NCHW_fp32_NCHW_KCRS_fp32_fp32_fp32_Accfloat_1_1_cC1_dC1_srcVec4_fltVec1_1_TP4_TQ7_C2_R1_S1_U1_V1 Tactic: 0xefc84642dd03beed Time: 0.125058
[12/14/2023-21:07:51] [V] [TRT] Tactic Name: sm50_xmma_conv_fprop_fused_conv_act_fp32_NCHW_fp32_NCHW_KCRS_fp32_fp32_fp32_Accfloat_1_1_cC1_dC1_srcVec1_fltVec2_2_TP3_TQ7_C8_R1_S1_U1_V1 Tactic: 0x4ec6e5a90546faa3 Time: 0.214601
[12/14/2023-21:07:51] [V] [TRT] Tactic Name: ampere_scudnn_128x32_relu_interior_nn_v1 Tactic: 0x9808072e706def96 Time: 0.101815
[12/14/2023-21:07:51] [V] [TRT] Tactic Name: sm80_xmma_fprop_implicit_gemm_f32f32_f32f32_f32_nchwkcrs_nchw_tilesize256x128x8_stage3_warpsize4x2x1_g1_ffma_aligna4_alignc4 Tactic: 0xbb8c3889c7eacd30 Time: 0.209189
[12/14/2023-21:07:51] [V] [TRT] Conv_3 (CaskConvolution[0x80000009]) profiling completed in 0.52261 seconds. Fastest Tactic: 0xb0bf940d5e0f9f45 Time: 0.0963383
[12/14/2023-21:07:51] [V] [TRT] --------------- Timing Runner: Conv_3 (CublasConvolution[0x80000029])
[12/14/2023-21:07:51] [V] [TRT] CublasConvolution has no valid tactics for this config, skipping
[12/14/2023-21:07:51] [V] [TRT] --------------- Timing Runner: Conv_3 (CudnnConvolution[0x80000000])
[12/14/2023-21:07:51] [V] [TRT] CudnnConvolution has no valid tactics for this config, skipping
[12/14/2023-21:07:51] [V] [TRT] --------------- Timing Runner: Conv_3 (CaskFlattenConvolution[0x80000036])
[12/14/2023-21:07:51] [V] [TRT] CaskFlattenConvolution has no valid tactics for this config, skipping
[12/14/2023-21:07:51] [V] [TRT] >>>>>>>>>>>>>>> Chose Runner Type: CaskConvolution Tactic: 0xb0bf940d5e0f9f45
[12/14/2023-21:07:51] [V] [TRT] *************** Autotuning format combination: Float(16588800,1,92160,512) -> Float(518400,1,2880,16) ***************
[12/14/2023-21:07:51] [V] [TRT] --------------- Timing Runner: Conv_3 (CaskConvolution[0x80000009])
[12/14/2023-21:07:51] [V] [TRT] Tactic Name: sm80_xmma_fprop_implicit_gemm_indexed_f32f32_f32f32_f32_nhwckrsc_nhwc_tilesize64x64x8_stage3_warpsize1x4x1_g1_ffma_aligna4_alignc4 Tactic: 0x19b688348f983aa0 Time: 0.13816
[12/14/2023-21:07:51] [V] [TRT] Tactic Name: sm80_xmma_fprop_implicit_gemm_f32f32_f32f32_f32_nhwckrsc_nhwc_tilesize128x16x8_stage3_warpsize4x1x1_g1_ffma_aligna4_alignc4 Tactic: 0x92ed3100c35fc43e Time: 0.106601
[12/14/2023-21:07:51] [V] [TRT] Tactic Name: ampere_scudnn_128x128_relu_exp_interior_nhwc_tn_v1 Tactic: 0x17173deba0b64484 Time: 0.228498
[12/14/2023-21:07:51] [V] [TRT] Tactic Name: sm80_xmma_fprop_implicit_gemm_f32f32_f32f32_f32_nhwckrsc_nhwc_tilesize128x64x8_stage3_warpsize2x2x1_g1_ffma_t1r1s1_aligna4_alignc4 Tactic: 0x35f26f9c09557d86 Time: 0.123392
[12/14/2023-21:07:51] [V] [TRT] Tactic Name: sm80_xmma_fprop_implicit_gemm_f32f32_f32f32_f32_nhwckrsc_nhwc_tilesize64x64x8_stage3_warpsize1x4x1_g1_ffma_simple_t1r1s1_aligna4_alignc4 Tactic: 0x90898977fc8ce537 Time: 0.125426
[12/14/2023-21:07:51] [V] [TRT] Tactic Name: sm80_xmma_fprop_implicit_gemm_f32f32_f32f32_f32_nhwckrsc_nhwc_tilesize256x64x8_stage3_warpsize2x2x1_g1_ffma_aligna4_alignc4 Tactic: 0x8014228ec08b4d49 Time: 0.120487
[12/14/2023-21:07:51] [V] [TRT] Tactic Name: sm80_xmma_fprop_implicit_gemm_f32f32_f32f32_f32_nhwckrsc_nhwc_tilesize64x128x8_stage3_warpsize1x4x1_g1_ffma_simple_t1r1s1_aligna4_alignc4 Tactic: 0xc7b3afceb5fb03c0 Time: 0.226304
[12/14/2023-21:07:51] [V] [TRT] Tactic Name: sm80_xmma_fprop_implicit_gemm_f32f32_f32f32_f32_nhwckrsc_nhwc_tilesize128x64x8_stage3_warpsize2x2x1_g1_ffma_simple_t1r1s1_aligna4_alignc4 Tactic: 0xd55ee6fd0b56f808 Time: 0.122953
[12/14/2023-21:07:51] [V] [TRT] Tactic Name: sm80_xmma_fprop_implicit_gemm_f32f32_f32f32_f32_nhwckrsc_nhwc_tilesize64x128x8_stage3_warpsize1x4x1_g1_ffma_t1r1s1_aligna4_alignc4 Tactic: 0x1022069e6f8d9aeb Time: 0.224402
[12/14/2023-21:07:51] [V] [TRT] Tactic Name: sm80_xmma_fprop_implicit_gemm_f32f32_f32f32_f32_nhwckrsc_nhwc_tilesize128x64x8_stage3_warpsize2x2x1_g1_ffma_aligna4_alignc4 Tactic: 0x1da91d865428f237 Time: 0.124896
[12/14/2023-21:07:51] [V] [TRT] Tactic Name: sm80_xmma_fprop_implicit_gemm_indexed_f32f32_f32f32_f32_nhwckrsc_nhwc_tilesize128x16x8_stage3_warpsize4x1x1_g1_ffma_aligna4_alignc4 Tactic: 0x4fd3c46622e98342 Time: 0.114615
[12/14/2023-21:07:51] [V] [TRT] Tactic Name: sm80_xmma_fprop_implicit_gemm_f32f32_f32f32_f32_nhwckrsc_nhwc_tilesize256x64x8_stage3_warpsize2x2x1_g1_ffma_simple_t1r1s1_aligna4_alignc4 Tactic: 0xbc0bba0ff1a92939 Time: 0.12341
[12/14/2023-21:07:51] [V] [TRT] Tactic Name: sm80_xmma_fprop_implicit_gemm_f32f32_f32f32_f32_nhwckrsc_nhwc_tilesize128x32x8_stage3_warpsize2x2x1_g1_ffma_simple_t1r1s1_aligna4_alignc4 Tactic: 0xd9eb6ca56ddc3a22 Time: 0.111543
[12/14/2023-21:07:51] [V] [TRT] Tactic Name: sm80_xmma_fprop_implicit_gemm_f32f32_f32f32_f32_nhwckrsc_nhwc_tilesize32x32x8_stage3_warpsize1x2x1_g1_ffma_simple_t1r1s1_aligna4_alignc4 Tactic: 0x1fb90698107bb33a Time: 0.101554
[12/14/2023-21:07:51] [V] [TRT] Tactic Name: sm80_xmma_fprop_implicit_gemm_f32f32_f32f32_f32_nhwckrsc_nhwc_tilesize32x32x8_stage3_warpsize1x2x1_g1_ffma_aligna4_alignc4 Tactic: 0x7121ec1db3f80c67 Time: 0.101589
[12/14/2023-21:07:51] [V] [TRT] Tactic Name: sm80_xmma_fprop_implicit_gemm_f32f32_f32f32_f32_nhwckrsc_nhwc_tilesize64x64x8_stage3_warpsize1x4x1_g1_ffma_t1r1s1_aligna4_alignc4 Tactic: 0x55d80c17b1cd982d Time: 0.124782
[12/14/2023-21:07:51] [V] [TRT] Tactic Name: sm80_xmma_fprop_implicit_gemm_indexed_f32f32_f32f32_f32_nhwckrsc_nhwc_tilesize32x32x8_stage3_warpsize1x2x1_g1_ffma_aligna4_alignc4 Tactic: 0x0a143be7a52f301a Time: 0.109934
[12/14/2023-21:07:52] [V] [TRT] Tactic Name: sm80_xmma_fprop_implicit_gemm_f32f32_f32f32_f32_nhwckrsc_nhwc_tilesize64x64x8_stage3_warpsize1x4x1_g1_ffma_aligna4_alignc4 Tactic: 0x62835fce994f06dd Time: 0.126391
[12/14/2023-21:07:52] [V] [TRT] Tactic Name: sm80_xmma_fprop_implicit_gemm_indexed_f32f32_f32f32_f32_nhwckrsc_nhwc_tilesize128x32x8_stage3_warpsize2x2x1_g1_ffma_aligna4_alignc4 Tactic: 0xa6448a1e79f1ca6f Time: 0.11008
[12/14/2023-21:07:52] [V] [TRT] Conv_3 (CaskConvolution[0x80000009]) profiling completed in 0.0893221 seconds. Fastest Tactic: 0x1fb90698107bb33a Time: 0.101554
[12/14/2023-21:07:52] [V] [TRT] --------------- Timing Runner: Conv_3 (CublasConvolution[0x80000029])
[12/14/2023-21:07:52] [V] [TRT] CublasConvolution has no valid tactics for this config, skipping
[12/14/2023-21:07:52] [V] [TRT] --------------- Timing Runner: Conv_3 (CaskGemmConvolution[0x8000002e])
[12/14/2023-21:07:52] [V] [TRT] CaskGemmConvolution has no valid tactics for this config, skipping
[12/14/2023-21:07:52] [V] [TRT] --------------- Timing Runner: Conv_3 (CaskFlattenConvolution[0x80000036])
[12/14/2023-21:07:52] [V] [TRT] CaskFlattenConvolution has no valid tactics for this config, skipping
[12/14/2023-21:07:52] [V] [TRT] >>>>>>>>>>>>>>> Chose Runner Type: CaskConvolution Tactic: 0x1fb90698107bb33a
[12/14/2023-21:07:52] [V] [TRT] *************** Autotuning format combination: Float(4147200,1:4,23040,128) -> Float(518400,32400,180,1) ***************
[12/14/2023-21:07:52] [V] [TRT] --------------- Timing Runner: Conv_3 (CaskConvolution[0x80000009])
[12/14/2023-21:07:52] [V] [TRT] Tactic Name: sm80_xmma_fprop_implicit_gemm_indexed_f32f32_tf32f32_f32_nhwckrsc_nchw_tilesize128x128x16_stage4_warpsize2x2x1_g1_tensor16x8x8_alignc4 Tactic: 0xe8f7b6a5bab325f8 Time: 0.166473
[12/14/2023-21:07:52] [V] [TRT] Tactic Name: sm80_xmma_fprop_implicit_gemm_f32f32_tf32f32_f32_nhwckrsc_nchw_tilesize128x128x16_stage4_warpsize2x2x1_g1_tensor16x8x8_simple_t1r1s1_alignc4 Tactic: 0x440241d9c93d605d Time: 0.156174
[12/14/2023-21:07:52] [V] [TRT] Tactic Name: sm80_xmma_fprop_implicit_gemm_f32f32_tf32f32_f32_nhwckrsc_nchw_tilesize128x128x16_stage4_warpsize2x2x1_g1_tensor16x8x8_t1r1s1_alignc4 Tactic: 0xc8ad2c0ce0af5623 Time: 0.156535
[12/14/2023-21:07:52] [V] [TRT] Tactic Name: sm80_xmma_fprop_implicit_gemm_f32f32_tf32f32_f32_nhwckrsc_nchw_tilesize128x128x16_stage4_warpsize2x2x1_g1_tensor16x8x8_alignc4 Tactic: 0x9fd9fe001908ce2e Time: 0.160037
[12/14/2023-21:07:52] [V] [TRT] Tactic Name: sm80_xmma_fprop_implicit_gemm_f32f32_tf32f32_f32_nhwckrsc_nchw_tilesize128x128x16_stage4_warpsize2x2x1_g1_tensor16x8x8_simple_t1r1s1 Tactic: 0x608ed7b5923d2355 Time: 0.155977
[12/14/2023-21:07:52] [V] [TRT] Tactic Name: sm80_xmma_fprop_implicit_gemm_indexed_f32f32_tf32f32_f32_nhwckrsc_nchw_tilesize128x128x16_stage4_warpsize2x2x1_g1_tensor16x8x8 Tactic: 0xe0a307ffe0ffb6a5 Time: 0.159744
[12/14/2023-21:07:52] [V] [TRT] Tactic Name: sm80_xmma_fprop_implicit_gemm_f32f32_tf32f32_f32_nhwckrsc_nchw_tilesize128x128x16_stage4_warpsize2x2x1_g1_tensor16x8x8_t1r1s1 Tactic: 0x1d144cf9675b8d6f Time: 0.155794
[12/14/2023-21:07:52] [V] [TRT] Tactic Name: sm80_xmma_fprop_implicit_gemm_f32f32_tf32f32_f32_nhwckrsc_nchw_tilesize128x128x16_stage4_warpsize2x2x1_g1_tensor16x8x8 Tactic: 0x3104d85fecdd547c Time: 0.155968
[12/14/2023-21:07:52] [V] [TRT] Conv_3 (CaskConvolution[0x80000009]) profiling completed in 0.0337345 seconds. Fastest Tactic: 0x1d144cf9675b8d6f Time: 0.155794
[12/14/2023-21:07:52] [V] [TRT] --------------- Timing Runner: Conv_3 (CaskFlattenConvolution[0x80000036])
[12/14/2023-21:07:52] [V] [TRT] CaskFlattenConvolution has no valid tactics for this config, skipping
[12/14/2023-21:07:52] [V] [TRT] >>>>>>>>>>>>>>> Chose Runner Type: CaskConvolution Tactic: 0x1d144cf9675b8d6f
[12/14/2023-21:07:52] [V] [TRT] *************** Autotuning format combination: Float(4147200,1:4,23040,128) -> Float(129600,1:4,720,4) ***************
[12/14/2023-21:07:52] [V] [TRT] --------------- Timing Runner: Conv_3 (CaskConvolution[0x80000009])
[12/14/2023-21:07:52] [V] [TRT] Tactic Name: ampere_scudnn_128x32_sliced1x4_ldg4_relu_exp_small_nhwc_tn_v1 Tactic: 0x3e2b881168d9689d Time: 0.0965486
[12/14/2023-21:07:52] [V] [TRT] Tactic Name: ampere_scudnn_128x128_ldg4_relu_exp_medium_nhwc_tn_v1 Tactic: 0x7bc32c782b800c48 Time: 0.221783
[12/14/2023-21:07:52] [V] [TRT] Tactic Name: ampere_scudnn_128x128_ldg4_relu_exp_small_nhwc_tn_v1 Tactic: 0xf90060ce8193b811 Time: 0.222062
[12/14/2023-21:07:52] [V] [TRT] Tactic Name: ampere_scudnn_128x128_ldg4_relu_exp_interior_nhwc_tn_v1 Tactic: 0xe47307053a42b3e4 Time: 0.220306
[12/14/2023-21:07:52] [V] [TRT] Tactic Name: ampere_scudnn_128x32_sliced1x4_ldg4_relu_exp_interior_nhwc_tn_v1 Tactic: 0xc7feb33970feefa7 Time: 0.095744
[12/14/2023-21:07:52] [V] [TRT] Tactic Name: ampere_scudnn_128x64_sliced1x2_ldg4_relu_exp_interior_nhwc_tn_v1 Tactic: 0xae0c89d047932ba3 Time: 0.121637
[12/14/2023-21:07:52] [V] [TRT] Tactic Name: sm80_xmma_fprop_implicit_gemm_f32f32_tf32f32_f32_nhwckrsc_nhwc_tilesize128x128x16_stage4_warpsize2x2x1_g1_tensor16x8x8_t1r1s1 Tactic: 0x130df49cb195156b Time: 0.154478
[12/14/2023-21:07:52] [V] [TRT] Tactic Name: sm80_xmma_fprop_implicit_gemm_f32f32_tf32f32_f32_nhwckrsc_nhwc_tilesize128x128x16_stage4_warpsize2x2x1_g1_tensor16x8x8_simple_t1r1s1 Tactic: 0x9dece0dc37e90462 Time: 0.153367
[12/14/2023-21:07:52] [V] [TRT] Tactic Name: sm80_xmma_fprop_implicit_gemm_f32f32_tf32f32_f32_nhwckrsc_nhwc_tilesize128x128x16_stage4_warpsize2x2x1_g1_tensor16x8x8 Tactic: 0xb443c221fcb1565b Time: 0.156791
[12/14/2023-21:07:52] [V] [TRT] Tactic Name: sm80_xmma_fprop_implicit_gemm_indexed_f32f32_tf32f32_f32_nhwckrsc_nhwc_tilesize128x128x16_stage4_warpsize2x2x1_g1_tensor16x8x8 Tactic: 0x65e41d81f093b482 Time: 0.161938
[12/14/2023-21:07:52] [V] [TRT] Conv_3 (CaskConvolution[0x80000009]) profiling completed in 0.0438083 seconds. Fastest Tactic: 0xc7feb33970feefa7 Time: 0.095744
[12/14/2023-21:07:52] [V] [TRT] --------------- Timing Runner: Conv_3 (CublasConvolution[0x80000029])
[12/14/2023-21:07:52] [V] [TRT] CublasConvolution has no valid tactics for this config, skipping
[12/14/2023-21:07:52] [V] [TRT] Conv_3: 224 available tactics, 0 unparsable, 112 pruned, 112 remaining after tactic pruning.
[12/14/2023-21:07:52] [V] [TRT] --------------- Timing Runner: Conv_3 (CaskGemmConvolution[0x8000002e])
[12/14/2023-21:07:52] [V] [TRT] Tactic Name: sm80_xmma_gemm_f32f32_tf32f32_f32_tn_n_tilesize32x32x64_stage3_warpsize2x1x2_tensor16x8x8 numSplitK: 1 numBuffers: 0 numKernels: 1 Tactic: 0x00000000000204bb Time: 0.0866743
[12/14/2023-21:07:52] [V] [TRT] Tactic Name: sm80_xmma_gemm_f32f32_tf32f32_f32_nn_n_tilesize32x32x64_stage3_warpsize2x1x2_tensor16x8x8 numSplitK: 1 numBuffers: 0 numKernels: 1 Tactic: 0x00000000000202f4 Time: 0.0866743
[12/14/2023-21:07:52] [V] [TRT] Tactic Name: sm80_xmma_gemm_f32f32_tf32f32_f32_nn_n_tilesize64x32x64_stage4_warpsize2x1x2_tensor16x8x8 numSplitK: 1 numBuffers: 0 numKernels: 1 Tactic: 0x000000000002031d Time: 0.0887223
[12/14/2023-21:07:52] [V] [TRT] Tactic Name: sm80_xmma_gemm_f32f32_tf32f32_f32_tn_n_tilesize64x32x64_stage4_warpsize2x1x2_tensor16x8x8 numSplitK: 1 numBuffers: 0 numKernels: 1 Tactic: 0x00000000000202bb Time: 0.0882743
[12/14/2023-21:07:52] [V] [TRT] Tactic Name: sm80_xmma_gemm_f32f32_tf32f32_f32_tn_n_tilesize64x128x16_stage4_warpsize2x2x1_tensor16x8x8 numSplitK: 1 numBuffers: 0 numKernels: 1 Tactic: 0x0000000000020399 Time: 0.129536
[12/14/2023-21:07:52] [V] [TRT] Tactic Name: sm80_xmma_gemm_f32f32_tf32f32_f32_nn_n_tilesize64x128x16_stage4_warpsize2x2x1_tensor16x8x8 numSplitK: 1 numBuffers: 0 numKernels: 1 Tactic: 0x000000000002059f Time: 0.127463
[12/14/2023-21:07:52] [V] [TRT] Tactic Name: sm80_xmma_gemm_f32f32_tf32f32_f32_nn_n_tilesize128x64x16_stage6_warpsize2x2x1_tensor16x8x8 numSplitK: 1 numBuffers: 0 numKernels: 1 Tactic: 0x0000000000020511 Time: 0.103856
[12/14/2023-21:07:52] [V] [TRT] Tactic Name: sm80_xmma_gemm_f32f32_tf32f32_f32_tn_n_tilesize128x64x16_stage6_warpsize2x2x1_tensor16x8x8 numSplitK: 1 numBuffers: 0 numKernels: 1 Tactic: 0x00000000000206ea Time: 0.103106
[12/14/2023-21:07:52] [V] [TRT] Tactic Name: sm80_xmma_gemm_f32f32_tf32f32_f32_nn_n_tilesize64x32x64_stage4_warpsize2x1x2_tensor16x8x8 numSplitK: 2 numBuffers: 1 numKernels: 1 Tactic: 0x000000000204031d Time: 0.103936
[12/14/2023-21:07:52] [V] [TRT] Tactic Name: sm80_xmma_gemm_f32f32_tf32f32_f32_tn_n_tilesize64x32x64_stage4_warpsize2x1x2_tensor16x8x8 numSplitK: 2 numBuffers: 1 numKernels: 1 Tactic: 0x00000000020402bb Time: 0.103383
[12/14/2023-21:07:52] [V] [TRT] Tactic Name: sm80_xmma_gemm_f32f32_tf32f32_f32_tn_n_tilesize32x32x64_stage3_warpsize2x1x2_tensor16x8x8 numSplitK: 2 numBuffers: 1 numKernels: 1 Tactic: 0x00000000020404bb Time: 0.100059
[12/14/2023-21:07:52] [V] [TRT] Tactic Name: sm80_xmma_gemm_f32f32_tf32f32_f32_nn_n_tilesize32x32x64_stage3_warpsize2x1x2_tensor16x8x8 numSplitK: 2 numBuffers: 1 numKernels: 1 Tactic: 0x00000000020402f4 Time: 0.100059
[12/14/2023-21:07:52] [V] [TRT] Tactic Name: sm80_xmma_gemm_f32f32_tf32f32_f32_nn_n_tilesize64x128x16_stage4_warpsize2x2x1_tensor16x8x8 numSplitK: 2 numBuffers: 1 numKernels: 1 Tactic: 0x000000000204059f Time: 0.212261
[12/14/2023-21:07:52] [V] [TRT] Tactic Name: sm80_xmma_gemm_f32f32_tf32f32_f32_tn_n_tilesize64x128x16_stage4_warpsize2x2x1_tensor16x8x8 numSplitK: 2 numBuffers: 1 numKernels: 1 Tactic: 0x0000000002040399 Time: 0.212297
[12/14/2023-21:07:52] [V] [TRT] Tactic Name: sm80_xmma_gemm_f32f32_tf32f32_f32_tn_n_tilesize128x64x16_stage6_warpsize2x2x1_tensor16x8x8 numSplitK: 2 numBuffers: 1 numKernels: 1 Tactic: 0x00000000020406ea Time: 0.193093
[12/14/2023-21:07:52] [V] [TRT] Tactic Name: sm80_xmma_gemm_f32f32_tf32f32_f32_nn_n_tilesize128x64x16_stage6_warpsize2x2x1_tensor16x8x8 numSplitK: 2 numBuffers: 1 numKernels: 1 Tactic: 0x0000000002040511 Time: 0.19339
[12/14/2023-21:07:52] [V] [TRT] Tactic Name: sm80_xmma_gemm_f32f32_tf32f32_f32_tn_n_tilesize64x32x64_stage4_warpsize2x1x2_tensor16x8x8 numSplitK: 2 numBuffers: 2 numKernels: 2 Tactic: 0x00000002040402bb Time: 0.11027
[12/14/2023-21:07:52] [V] [TRT] Tactic Name: sm80_xmma_gemm_f32f32_tf32f32_f32_nn_n_tilesize64x32x64_stage4_warpsize2x1x2_tensor16x8x8 numSplitK: 2 numBuffers: 2 numKernels: 2 Tactic: 0x000000020404031d Time: 0.110738
[12/14/2023-21:07:52] [V] [TRT] Tactic Name: sm80_xmma_gemm_f32f32_tf32f32_f32_nn_n_tilesize32x32x64_stage3_warpsize2x1x2_tensor16x8x8 numSplitK: 2 numBuffers: 2 numKernels: 2 Tactic: 0x00000002040402f4 Time: 0.109056
[12/14/2023-21:07:52] [V] [TRT] Tactic Name: sm80_xmma_gemm_f32f32_tf32f32_f32_tn_n_tilesize32x32x64_stage3_warpsize2x1x2_tensor16x8x8 numSplitK: 2 numBuffers: 2 numKernels: 2 Tactic: 0x00000002040404bb Time: 0.109275
[12/14/2023-21:07:52] [V] [TRT] Tactic Name: sm80_xmma_gemm_f32f32_tf32f32_f32_nn_n_tilesize64x128x16_stage4_warpsize2x2x1_tensor16x8x8 numSplitK: 2 numBuffers: 2 numKernels: 2 Tactic: 0x000000020404059f Time: 0.25483
[12/14/2023-21:07:52] [V] [TRT] Tactic Name: sm80_xmma_gemm_f32f32_tf32f32_f32_tn_n_tilesize64x128x16_stage4_warpsize2x2x1_tensor16x8x8 numSplitK: 2 numBuffers: 2 numKernels: 2 Tactic: 0x0000000204040399 Time: 0.255822
[12/14/2023-21:07:52] [V] [TRT] Tactic Name: sm80_xmma_gemm_f32f32_tf32f32_f32_nn_n_tilesize128x64x16_stage6_warpsize2x2x1_tensor16x8x8 numSplitK: 2 numBuffers: 2 numKernels: 2 Tactic: 0x0000000204040511 Time: 0.212261
[12/14/2023-21:07:52] [V] [TRT] Tactic Name: sm80_xmma_gemm_f32f32_tf32f32_f32_tn_n_tilesize128x64x16_stage6_warpsize2x2x1_tensor16x8x8 numSplitK: 2 numBuffers: 2 numKernels: 2 Tactic: 0x00000002040406ea Time: 0.211968
[12/14/2023-21:07:52] [V] [TRT] Tactic Name: sm80_xmma_gemm_f32f32_tf32f32_f32_nn_n_tilesize128x64x16_stage6_warpsize2x2x1_tensor16x8x8 numSplitK: 3 numBuffers: 2 numKernels: 1 Tactic: 0x0000000004060511 Time: 0.21109
[12/14/2023-21:07:52] [V] [TRT] Tactic Name: sm80_xmma_gemm_f32f32_tf32f32_f32_tn_n_tilesize128x64x16_stage6_warpsize2x2x1_tensor16x8x8 numSplitK: 3 numBuffers: 2 numKernels: 1 Tactic: 0x00000000040606ea Time: 0.21387
[12/14/2023-21:07:52] [V] [TRT] Tactic Name: sm80_xmma_gemm_f32f32_tf32f32_f32_nn_n_tilesize32x32x64_stage3_warpsize2x1x2_tensor16x8x8 numSplitK: 3 numBuffers: 2 numKernels: 1 Tactic: 0x00000000040602f4 Time: 0.109056
[12/14/2023-21:07:52] [V] [TRT] Tactic Name: sm80_xmma_gemm_f32f32_tf32f32_f32_tn_n_tilesize32x32x64_stage3_warpsize2x1x2_tensor16x8x8 numSplitK: 3 numBuffers: 2 numKernels: 1 Tactic: 0x00000000040604bb Time: 0.109643
[12/14/2023-21:07:52] [V] [TRT] Tactic Name: sm80_xmma_gemm_f32f32_tf32f32_f32_nn_n_tilesize64x32x64_stage4_warpsize2x1x2_tensor16x8x8 numSplitK: 3 numBuffers: 2 numKernels: 1 Tactic: 0x000000000406031d Time: 0.119442
[12/14/2023-21:07:52] [V] [TRT] Tactic Name: sm80_xmma_gemm_f32f32_tf32f32_f32_tn_n_tilesize64x32x64_stage4_warpsize2x1x2_tensor16x8x8 numSplitK: 3 numBuffers: 2 numKernels: 1 Tactic: 0x00000000040602bb Time: 0.118784
[12/14/2023-21:07:52] [V] [TRT] Tactic Name: sm80_xmma_gemm_f32f32_tf32f32_f32_tn_n_tilesize128x128x16_stage4_warpsize2x2x1_tensor16x8x8 numSplitK: 2 numBuffers: 1 numKernels: 1 Tactic: 0x000000000204027d Time: 0.218112
[12/14/2023-21:07:52] [V] [TRT] Tactic Name: sm80_xmma_gemm_f32f32_tf32f32_f32_nn_n_tilesize128x128x16_stage4_warpsize2x2x1_tensor16x8x8 numSplitK: 2 numBuffers: 1 numKernels: 1 Tactic: 0x0000000002040296 Time: 0.217527
[12/14/2023-21:07:52] [V] [TRT] Tactic Name: sm80_xmma_gemm_f32f32_tf32f32_f32_nn_n_tilesize128x64x16_stage6_warpsize2x2x1_tensor16x8x8 numSplitK: 3 numBuffers: 3 numKernels: 2 Tactic: 0x0000000206060511 Time: 0.232594
[12/14/2023-21:07:52] [V] [TRT] Tactic Name: sm80_xmma_gemm_f32f32_tf32f32_f32_tn_n_tilesize128x64x16_stage6_warpsize2x2x1_tensor16x8x8 numSplitK: 3 numBuffers: 3 numKernels: 2 Tactic: 0x00000002060606ea Time: 0.236206
[12/14/2023-21:07:52] [V] [TRT] Tactic Name: sm80_xmma_gemm_f32f32_tf32f32_f32_nn_n_tilesize32x32x64_stage3_warpsize2x1x2_tensor16x8x8 numSplitK: 3 numBuffers: 3 numKernels: 2 Tactic: 0x00000002060602f4 Time: 0.11915
[12/14/2023-21:07:52] [V] [TRT] Tactic Name: sm80_xmma_gemm_f32f32_tf32f32_f32_tn_n_tilesize32x32x64_stage3_warpsize2x1x2_tensor16x8x8 numSplitK: 3 numBuffers: 3 numKernels: 2 Tactic: 0x00000002060604bb Time: 0.119733
[12/14/2023-21:07:52] [V] [TRT] Tactic Name: sm86_xmma_gemm_f32f32_tf32f32_f32_tn_n_tilesize256x64x32_stage2_warpsize4x1x1_tensor16x8x8 numSplitK: 1 numBuffers: 0 numKernels: 1 Tactic: 0x0000000000020382 Time: 0.101157
[12/14/2023-21:07:52] [V] [TRT] Tactic Name: sm86_xmma_gemm_f32f32_tf32f32_f32_nn_n_tilesize256x64x32_stage2_warpsize4x1x1_tensor16x8x8 numSplitK: 1 numBuffers: 0 numKernels: 1 Tactic: 0x00000000000207d1 Time: 0.104155
[12/14/2023-21:07:52] [V] [TRT] Tactic Name: sm80_xmma_gemm_f32f32_tf32f32_f32_nn_n_tilesize64x128x16_stage4_warpsize2x2x1_tensor16x8x8 numSplitK: 3 numBuffers: 2 numKernels: 1 Tactic: 0x000000000406059f Time: 0.250441
[12/14/2023-21:07:52] [V] [TRT] Tactic Name: sm80_xmma_gemm_f32f32_tf32f32_f32_tn_n_tilesize64x128x16_stage4_warpsize2x2x1_tensor16x8x8 numSplitK: 3 numBuffers: 2 numKernels: 1 Tactic: 0x0000000004060399 Time: 0.251465
[12/14/2023-21:07:52] [V] [TRT] Tactic Name: sm80_xmma_gemm_f32f32_tf32f32_f32_tn_n_tilesize128x128x16_stage4_warpsize2x2x1_tensor16x8x8 numSplitK: 3 numBuffers: 2 numKernels: 1 Tactic: 0x000000000406027d Time: 0.253952
[12/14/2023-21:07:52] [V] [TRT] Tactic Name: sm80_xmma_gemm_f32f32_tf32f32_f32_nn_n_tilesize128x128x16_stage4_warpsize2x2x1_tensor16x8x8 numSplitK: 3 numBuffers: 2 numKernels: 1 Tactic: 0x0000000004060296 Time: 0.253952
[12/14/2023-21:07:52] [V] [TRT] Tactic Name: sm80_xmma_gemm_f32f32_tf32f32_f32_tn_n_tilesize128x128x16_stage4_warpsize2x2x1_tensor16x8x8 numSplitK: 1 numBuffers: 0 numKernels: 1 Tactic: 0x000000000002027d Time: 0.151113
[12/14/2023-21:07:52] [V] [TRT] Tactic Name: sm80_xmma_gemm_f32f32_tf32f32_f32_nn_n_tilesize128x128x16_stage4_warpsize2x2x1_tensor16x8x8 numSplitK: 1 numBuffers: 0 numKernels: 1 Tactic: 0x0000000000020296 Time: 0.149065
[12/14/2023-21:07:52] [V] [TRT] Tactic Name: sm80_xmma_gemm_f32f32_tf32f32_f32_tn_n_tilesize64x32x64_stage4_warpsize2x1x2_tensor16x8x8 numSplitK: 3 numBuffers: 3 numKernels: 2 Tactic: 0x00000002060602bb Time: 0.121321
[12/14/2023-21:07:52] [V] [TRT] Tactic Name: sm80_xmma_gemm_f32f32_tf32f32_f32_nn_n_tilesize64x32x64_stage4_warpsize2x1x2_tensor16x8x8 numSplitK: 3 numBuffers: 3 numKernels: 2 Tactic: 0x000000020606031d Time: 0.122149
[12/14/2023-21:07:52] [V] [TRT] Tactic Name: sm80_xmma_gemm_f32f32_tf32f32_f32_tn_n_tilesize128x128x16_stage4_warpsize2x2x1_tensor16x8x8 numSplitK: 2 numBuffers: 2 numKernels: 2 Tactic: 0x000000020404027d Time: 0.256146
[12/14/2023-21:07:52] [V] [TRT] Tactic Name: sm80_xmma_gemm_f32f32_tf32f32_f32_nn_n_tilesize128x128x16_stage4_warpsize2x2x1_tensor16x8x8 numSplitK: 2 numBuffers: 2 numKernels: 2 Tactic: 0x0000000204040296 Time: 0.256585
[12/14/2023-21:07:52] [V] [TRT] Tactic Name: sm86_xmma_gemm_f32f32_tf32f32_f32_nn_n_tilesize64x32x64_stage4_warpsize2x2x1_tensor16x8x8 numSplitK: 1 numBuffers: 0 numKernels: 1 Tactic: 0x0000000000020366 Time: 0.0898194
[12/14/2023-21:07:52] [V] [TRT] Tactic Name: sm86_xmma_gemm_f32f32_tf32f32_f32_tn_n_tilesize64x32x64_stage4_warpsize2x2x1_tensor16x8x8 numSplitK: 1 numBuffers: 0 numKernels: 1 Tactic: 0x00000000000202e8 Time: 0.0884297
[12/14/2023-21:07:52] [V] [TRT] Tactic Name: sm80_xmma_gemm_f32f32_tf32f32_f32_nn_n_tilesize128x64x16_stage6_warpsize2x2x1_tensor16x8x8 numSplitK: 4 numBuffers: 3 numKernels: 1 Tactic: 0x0000000006080511 Time: 0.230921
[12/14/2023-21:07:52] [V] [TRT] Tactic Name: sm80_xmma_gemm_f32f32_tf32f32_f32_tn_n_tilesize128x64x16_stage6_warpsize2x2x1_tensor16x8x8 numSplitK: 4 numBuffers: 3 numKernels: 1 Tactic: 0x00000000060806ea Time: 0.231131
[12/14/2023-21:07:52] [V] [TRT] Tactic Name: sm80_xmma_gemm_f32f32_tf32f32_f32_tn_n_tilesize32x32x64_stage3_warpsize2x1x2_tensor16x8x8 numSplitK: 4 numBuffers: 3 numKernels: 1 Tactic: 0x00000000060804bb Time: 0.11899
[12/14/2023-21:07:52] [V] [TRT] Tactic Name: sm80_xmma_gemm_f32f32_tf32f32_f32_nn_n_tilesize32x32x64_stage3_warpsize2x1x2_tensor16x8x8 numSplitK: 4 numBuffers: 3 numKernels: 1 Tactic: 0x00000000060802f4 Time: 0.118272
[12/14/2023-21:07:52] [V] [TRT] Tactic Name: sm80_xmma_gemm_f32f32_tf32f32_f32_tn_n_tilesize64x32x64_stage4_warpsize2x1x2_tensor16x8x8 numSplitK: 4 numBuffers: 3 numKernels: 1 Tactic: 0x00000000060802bb Time: 0.127291
[12/14/2023-21:07:52] [V] [TRT] Tactic Name: sm80_xmma_gemm_f32f32_tf32f32_f32_nn_n_tilesize64x32x64_stage4_warpsize2x1x2_tensor16x8x8 numSplitK: 4 numBuffers: 3 numKernels: 1 Tactic: 0x000000000608031d Time: 0.127739
[12/14/2023-21:07:52] [V] [TRT] Tactic Name: sm80_xmma_gemm_f32f32_tf32f32_f32_nn_n_tilesize64x128x16_stage4_warpsize2x2x1_tensor16x8x8 numSplitK: 3 numBuffers: 3 numKernels: 2 Tactic: 0x000000020606059f Time: 0.389851
[12/14/2023-21:07:52] [V] [TRT] Tactic Name: sm80_xmma_gemm_f32f32_tf32f32_f32_tn_n_tilesize64x128x16_stage4_warpsize2x2x1_tensor16x8x8 numSplitK: 3 numBuffers: 3 numKernels: 2 Tactic: 0x0000000206060399 Time: 0.386487
[12/14/2023-21:07:52] [V] [TRT] Tactic Name: sm80_xmma_gemm_f32f32_tf32f32_f32_tn_n_tilesize128x128x16_stage4_warpsize2x2x1_tensor16x8x8 numSplitK: 3 numBuffers: 3 numKernels: 2 Tactic: 0x000000020606027d Time: 0.391753
[12/14/2023-21:07:52] [V] [TRT] Tactic Name: sm80_xmma_gemm_f32f32_tf32f32_f32_nn_n_tilesize128x128x16_stage4_warpsize2x2x1_tensor16x8x8 numSplitK: 3 numBuffers: 3 numKernels: 2 Tactic: 0x0000000206060296 Time: 0.390875
[12/14/2023-21:07:52] [V] [TRT] Tactic Name: sm80_xmma_gemm_f32f32_tf32f32_f32_nn_n_tilesize64x128x16_stage4_warpsize2x2x1_tensor16x8x8 numSplitK: 4 numBuffers: 3 numKernels: 1 Tactic: 0x000000000608059f Time: 0.374491
[12/14/2023-21:07:52] [V] [TRT] Tactic Name: sm80_xmma_gemm_f32f32_tf32f32_f32_tn_n_tilesize64x128x16_stage4_warpsize2x2x1_tensor16x8x8 numSplitK: 4 numBuffers: 3 numKernels: 1 Tactic: 0x0000000006080399 Time: 0.373906
[12/14/2023-21:07:52] [V] [TRT] Tactic Name: sm80_xmma_gemm_f32f32_tf32f32_f32_tn_n_tilesize128x128x16_stage4_warpsize2x2x1_tensor16x8x8 numSplitK: 4 numBuffers: 3 numKernels: 1 Tactic: 0x000000000608027d Time: 0.371858
[12/14/2023-21:07:52] [V] [TRT] Tactic Name: sm80_xmma_gemm_f32f32_tf32f32_f32_nn_n_tilesize128x128x16_stage4_warpsize2x2x1_tensor16x8x8 numSplitK: 4 numBuffers: 3 numKernels: 1 Tactic: 0x0000000006080296 Time: 0.376832
[12/14/2023-21:07:52] [V] [TRT] Tactic Name: sm80_xmma_gemm_f32f32_tf32f32_f32_nn_n_tilesize128x64x16_stage6_warpsize2x2x1_tensor16x8x8 numSplitK: 4 numBuffers: 4 numKernels: 2 Tactic: 0x0000000208080511 Time: 0.251173
[12/14/2023-21:07:52] [V] [TRT] Tactic Name: sm80_xmma_gemm_f32f32_tf32f32_f32_tn_n_tilesize128x64x16_stage6_warpsize2x2x1_tensor16x8x8 numSplitK: 4 numBuffers: 4 numKernels: 2 Tactic: 0x00000002080806ea Time: 0.257166
[12/14/2023-21:07:52] [V] [TRT] Tactic Name: sm80_xmma_gemm_f32f32_tf32f32_f32_nn_n_tilesize32x32x64_stage3_warpsize2x1x2_tensor16x8x8 numSplitK: 4 numBuffers: 4 numKernels: 2 Tactic: 0x00000002080802f4 Time: 0.128974
[12/14/2023-21:07:52] [V] [TRT] Tactic Name: sm80_xmma_gemm_f32f32_tf32f32_f32_tn_n_tilesize32x32x64_stage3_warpsize2x1x2_tensor16x8x8 numSplitK: 4 numBuffers: 4 numKernels: 2 Tactic: 0x00000002080804bb Time: 0.129344
[12/14/2023-21:07:52] [V] [TRT] Tactic Name: sm80_xmma_gemm_f32f32_tf32f32_f32_tn_n_tilesize64x32x64_stage4_warpsize2x1x2_tensor16x8x8 numSplitK: 4 numBuffers: 4 numKernels: 2 Tactic: 0x00000002080802bb Time: 0.131145
[12/14/2023-21:07:52] [V] [TRT] Tactic Name: sm80_xmma_gemm_f32f32_tf32f32_f32_nn_n_tilesize64x32x64_stage4_warpsize2x1x2_tensor16x8x8 numSplitK: 4 numBuffers: 4 numKernels: 2 Tactic: 0x000000020808031d Time: 0.13056
[12/14/2023-21:07:52] [V] [TRT] Tactic Name: sm80_xmma_gemm_f32f32_tf32f32_f32_tn_n_tilesize64x128x16_stage4_warpsize2x2x1_tensor16x8x8 numSplitK: 4 numBuffers: 4 numKernels: 2 Tactic: 0x0000000208080399 Time: 0.43637
[12/14/2023-21:07:52] [V] [TRT] Tactic Name: sm80_xmma_gemm_f32f32_tf32f32_f32_nn_n_tilesize64x128x16_stage4_warpsize2x2x1_tensor16x8x8 numSplitK: 4 numBuffers: 4 numKernels: 2 Tactic: 0x000000020808059f Time: 0.437394
[12/14/2023-21:07:52] [V] [TRT] Tactic Name: sm80_xmma_gemm_f32f32_tf32f32_f32_tn_n_tilesize128x128x16_stage4_warpsize2x2x1_tensor16x8x8 numSplitK: 4 numBuffers: 4 numKernels: 2 Tactic: 0x000000020808027d Time: 0.429202
[12/14/2023-21:07:52] [V] [TRT] Tactic Name: sm80_xmma_gemm_f32f32_tf32f32_f32_nn_n_tilesize128x128x16_stage4_warpsize2x2x1_tensor16x8x8 numSplitK: 4 numBuffers: 4 numKernels: 2 Tactic: 0x0000000208080296 Time: 0.425691
[12/14/2023-21:07:52] [V] [TRT] Tactic Name: sm86_xmma_gemm_f32f32_tf32f32_f32_nn_n_tilesize64x32x64_stage4_warpsize2x2x1_tensor16x8x8 numSplitK: 2 numBuffers: 1 numKernels: 1 Tactic: 0x0000000002040366 Time: 0.103221
[12/14/2023-21:07:52] [V] [TRT] Tactic Name: sm86_xmma_gemm_f32f32_tf32f32_f32_tn_n_tilesize64x32x64_stage4_warpsize2x2x1_tensor16x8x8 numSplitK: 2 numBuffers: 1 numKernels: 1 Tactic: 0x00000000020402e8 Time: 0.102181
